id,url,media,score,title,author,edited,is_self,over_18,preview,spoiler,selftext,stickied,permalink,subreddit,created_utc,num_comments,upvote_ratio,link_flair_text
1mykwft,https://www.reddit.com/r/HellLetLoose/comments/1mykwft/never_played_hll_intrigured_by_hllv_trailer/,,0,Never played HLL - Intrigured by HLLV trailer,Historical_Fold787,False,True,False,,False,"Hello.

I'm eagerly awaiting BF6 however I saw the trailer for HLLV pop up on my feed and it looks awesome. The environment, theme, vehicles and weapons look very fun.

I know nothing about HLL whatsoever but I was thinking I might get HLLV and play it alongside BF6.

So, how does a typical HLL round play out? What sort of weapons are mainly used? I understand it's more of a milsim so I'm assuming it's generally a 1-2 shot kill and guns are almost always used in semi auto? How do the game modes work? Are tanks etc. very strong?

What sort of things should I keep in mind coming from Battlefield? 

I'm very keen to give this game a go.

Thanks,",False,/r/HellLetLoose/comments/1mykwft/never_played_hll_intrigured_by_hllv_trailer/,HellLetLoose,1756005270.0,9,0.3,🙋‍♂️  Question  🙋‍♂️
1myktqu,https://www.reddit.com/r/Battlefield/comments/1myktqu/how_to_scratch_bf6_itch/,,1,How to scratch BF6 itch?,Ashamed_Ad_7753,False,True,False,,False,How do I scratch that itch? Tried playing Delta Force and it was doo doo water.,False,/r/Battlefield/comments/1myktqu/how_to_scratch_bf6_itch/,Battlefield,1756005026.0,8,0.67,Battlefield 6
1myktj5,https://i.redd.it/4k1mkt2gwvkf1.jpeg,,88,[Post de ódio a UE5] O que está acontecendo com a otimização dos jogos? Tudo o que importa são visuais? F*da-se a funcionalidade?,ixaias,False,False,False,"{'images': [{'id': 'd-2-GNPx7ZGjWlRG02iSuFawgA2bLMGEjkJlfpNyxqY', 'source': {'url': 'https://preview.redd.it/4k1mkt2gwvkf1.jpeg?auto=webp&s=b38ff221f7abb88d055faaf3d41595899d8449d7', 'width': 738, 'height': 415}, 'variants': {}, 'resolutions': [{'url': 'https://preview.redd.it/4k1mkt2gwvkf1.jpeg?width=108&crop=smart&auto=webp&s=802a3c0c030d3f5cac062acf094add9b7386a405', 'width': 108, 'height': 60}, {'url': 'https://preview.redd.it/4k1mkt2gwvkf1.jpeg?width=216&crop=smart&auto=webp&s=e80c0920a4ff8694be114e31a5bf9b6ca0c0d144', 'width': 216, 'height': 121}, {'url': 'https://preview.redd.it/4k1mkt2gwvkf1.jpeg?width=320&crop=smart&auto=webp&s=1757d4002014f4fb2619429879a90b412cfe01f4', 'width': 320, 'height': 179}, {'url': 'https://preview.redd.it/4k1mkt2gwvkf1.jpeg?width=640&crop=smart&auto=webp&s=411107168b576aa3e8c6ae115df8a0cf6f183c0e', 'width': 640, 'height': 359}]}], 'enabled': True}",False,"Basicamente o título.

MGS Delta sai logo logo e já temos benchmarks ruins do game. Sofrendo pra rodar em ótimas GPUs (tipo a RTX 4060) e nos consoles de mesa (PS5 e PS5 PRO). Esse era um dos jogos que eu tava mais hypando pra jogar no lançamento e agora toda a vontade se foi por causa da preguiça crônica do desenvolvedor de querer otimizar o jogo corretamente. 

Outros exemplos: TESIV Oblivion Remastered. Como já podem ver pela minha flair, meu hardware, sim, é de entrada, especialmente em 2025. Porém, consigo rodar muitos jogos em qualidade alta sem suar. Red Dead 2, RE4 Remake (naquele preset priorizar qualidade), AC Mirage, BF6, entre outros. TODOS ESSES graficamente muito mais impressionantes que Oblivion. E ainda assim, depois de 4 meses de lançamento, o jogo continua injogável na minha máquina. Engasgos, ghosting, input lag, bugs que quebram o jogo, etc. Este era o jogo que eu mais queria jogar esse ano.

Aí que eu me pergunto: em que momento se tornou aceitável pagar 70 dólares em jogos incompletos? Em que momento ficamos de cabeça abaixada pra desenvolvedoras que não tem a mínima vontade de ao menos trabalhar em fazer pelo menos os reflexos da água, vidro etc sem recorrer ao Ray Tracing, que, apesar de impressionante visualmente, é inviável pra 70, 80% dos jogadores de PC? 

É ultrajante, no mínimo.

(aos que vão comentar logo, sim, eu entendo que a UE5 é muito acessível pra estúdios menores e que vai ser o padrão da indústria logo. Mas peguem Expedition 33 como um exemplo. Aquilo é jogo bonito e otimizado de maneira decente.)
",False,/r/gamesEcultura/comments/1myktj5/post_de_ódio_a_ue5_o_que_está_acontecendo_com_a/,gamesEcultura,1756005008.0,89,0.87,desabafos de nerd
1mykt4c,https://www.youtube.com/watch?v=FLSXgoi0-uY&ab_channel=wexfordlad1,"{'type': 'youtube.com', 'oembed': {'html': '<iframe width=""356"" height=""200"" src=""https://www.youtube.com/embed/FLSXgoi0-uY?feature=oembed&enablejsapi=1"" frameborder=""0"" allow=""accelerometer; autoplay; clipboard-write; encrypted-media; gyroscope; picture-in-picture; web-share"" referrerpolicy=""strict-origin-when-cross-origin"" allowfullscreen title=""When Bombing Runs Go Right: Battlefield 4 Gameplay""></iframe>', 'type': 'video', 'title': 'When Bombing Runs Go Right: Battlefield 4 Gameplay', 'width': 356, 'height': 200, 'version': '1.0', 'author_url': 'https://www.youtube.com/@wexfordlad1', 'author_name': 'wexfordlad1', 'provider_url': 'https://www.youtube.com/', 'provider_name': 'YouTube', 'thumbnail_url': 'https://i.ytimg.com/vi/FLSXgoi0-uY/hqdefault.jpg', 'thumbnail_width': 480, 'thumbnail_height': 360}}",1,pls dice bring it back on bf6,jack6531999,False,False,False,"{'images': [{'id': 'pNbQGt195RLW-rM8rJLQFyzBk_whu5t0xudaGGrjWSg', 'source': {'url': 'https://external-preview.redd.it/pNbQGt195RLW-rM8rJLQFyzBk_whu5t0xudaGGrjWSg.jpeg?auto=webp&s=1660af80ba16c899f56da5fda4f4fdb237f8a519', 'width': 480, 'height': 360}, 'variants': {}, 'resolutions': [{'url': 'https://external-preview.redd.it/pNbQGt195RLW-rM8rJLQFyzBk_whu5t0xudaGGrjWSg.jpeg?width=108&crop=smart&auto=webp&s=4b03df1b4861e35c491eadc9776c9605499261af', 'width': 108, 'height': 81}, {'url': 'https://external-preview.redd.it/pNbQGt195RLW-rM8rJLQFyzBk_whu5t0xudaGGrjWSg.jpeg?width=216&crop=smart&auto=webp&s=90dc1734ce43d2b676cd12c7320cf75e1e119223', 'width': 216, 'height': 162}, {'url': 'https://external-preview.redd.it/pNbQGt195RLW-rM8rJLQFyzBk_whu5t0xudaGGrjWSg.jpeg?width=320&crop=smart&auto=webp&s=188dab0ebcacb3bc1bda3b7e9f9202a85bf02bba', 'width': 320, 'height': 240}]}], 'enabled': False}",False,"or somthing like bf1 behemoths 

[https://www.youtube.com/watch?v=NKSmH\_ANH78&ab\_channel=Astyag](https://www.youtube.com/watch?v=NKSmH_ANH78&ab_channel=Astyag)

  
[https://www.youtube.com/watch?v=FLSXgoi0-uY&ab\_channel=wexfordlad1](https://www.youtube.com/watch?v=FLSXgoi0-uY&ab_channel=wexfordlad1)",False,/r/Battlefield/comments/1mykt4c/pls_dice_bring_it_back_on_bf6/,Battlefield,1756004973.0,0,0.67,Battlefield 6
1mykepz,https://i.redd.it/rwnbwacksvkf1.jpeg,,5672,BF6 with no filter looks so much better,dubdimmadome,False,False,False,"{'images': [{'id': 'I85Y69UMXFyWlqWDzeGzCJqjYwUs2A1iVBp7RGlk2FU', 'source': {'url': 'https://preview.redd.it/rwnbwacksvkf1.jpeg?auto=webp&s=d5ebaf81b0738a221e80676e18307cd4190dd37f', 'width': 1080, 'height': 1215}, 'variants': {}, 'resolutions': [{'url': 'https://preview.redd.it/rwnbwacksvkf1.jpeg?width=108&crop=smart&auto=webp&s=9559bd03de40948e2d1ca6b246706d6dde39e71b', 'width': 108, 'height': 121}, {'url': 'https://preview.redd.it/rwnbwacksvkf1.jpeg?width=216&crop=smart&auto=webp&s=4c147afb2eb4b3aa2b626c50aa5696f99a3a4234', 'width': 216, 'height': 243}, {'url': 'https://preview.redd.it/rwnbwacksvkf1.jpeg?width=320&crop=smart&auto=webp&s=d23280ec504fcfbc6e7e8525b673f0df1c623481', 'width': 320, 'height': 360}, {'url': 'https://preview.redd.it/rwnbwacksvkf1.jpeg?width=640&crop=smart&auto=webp&s=72db0a1e3efeee70fa3cfa80bd4e82469e0ac412', 'width': 640, 'height': 720}, {'url': 'https://preview.redd.it/rwnbwacksvkf1.jpeg?width=960&crop=smart&auto=webp&s=c15e4a828c0d386da221d831cbec734c4698f21d', 'width': 960, 'height': 1080}, {'url': 'https://preview.redd.it/rwnbwacksvkf1.jpeg?width=1080&crop=smart&auto=webp&s=b6c85c68aad4eb6f714ae50a4980e57c030eb96b', 'width': 1080, 'height': 1215}]}], 'enabled': True}",False,This games beauty is hiding behind the filter just like BF3. Take a look at it,False,/r/Battlefield/comments/1mykepz/bf6_with_no_filter_looks_so_much_better/,Battlefield,1756003701.0,776,0.79,Battlefield 6
1myk47f,https://www.reddit.com/r/GamingLaptops/comments/1myk47f/help_needed_choosing_software_dev/,,1,Help needed Choosing (Software Dev),Healthy_Bug8892,1756004624.0,True,False,,False,"**Total budget (in local currency) and country of purchase. Please do not use USD unless purchasing in the US:**  
€1200\~1500 have be available to buy within Ireland or from a company that will not have import fees added so no UK websites.

**Are you open to refurbs/used?**  
No

**How would you prioritize form factor (Ultrabook, 2-in-1, etc.), build quality, performance, and battery life?**  
Thin and light as possible for the other requirements. Also would like it to be quite while doing general collage work as to not hinder other students.

**How important is weight and thinness to you?**  
Weight and thinness are very important to me — I’m looking for something easy to carry while traveling.

**Do you have a preferred screen size? If indifferent, put N/A.**  
14\~16""

**Are you doing any CAD/video editing/photo editing/gaming? List which programs/games you desire to run.**  
Yes, Cad for modeling some light 3d models for 3d printing as well as small bit of gaming while traveling. Have a gaming desktop.

**If you're gaming, do you have certain games you want to play? At what settings and FPS do you want?**  
Play ark: ascended, war thunder, bf6 but generally not trying game on the laptop.

**Any specific requirements such as good keyboard, reliable build quality, touch-screen, finger-print reader, optical drive or good input devices (keyboard/touchpad)?**  
Good Keyboard, good build quality, has to allow for usb-c charging even if only while running on integrated graphics.

**Leave any finishing thoughts here that you may feel are necessary and beneficial to the discussion.**  
Looking for a bit of help with this decision trying to keep the laptop as a work, study tool as opposed to gaming due to the fact that it would hinder my productivity but would be nice to have the option of some moderate gaming while traveling etc. **Generally worried about being tethered to a wall socket while running basic applications for collage work.**

Have a few laptop's in mind but cant come to a final decision on any of them:

Option #1: **Lenovo IdeaPad Pro 5 Gen 10 (16” AMD)**: R7 AI7 350, RTX 5050 8GB v-ram, 32gb ram, 1tb SSD

Like the option best because it would allow me to do Lenovo's advanced insurance for the 4 year care plan. But no Guaranteed shipping date and from some reviews the shipping can be delayed as its a build to order. Says ships within 6-9 days.

€1500\~ inc shipping and warranty

Option #2: **Asus Vivobook Pro 15 Oled N6506CU:** Intel® Core Ultra 9 Processor 285H, RTX 4050 6GB v-ram, 16gb ram, 1tb SSD.

Reason I like this option is it is currently available to order and delivery is within the week but no option for a extended warranty. From what I've read ram is expandible to at least 24gb ram according to ASUS website.

€1200

Open to further options but please share links.

Thanks in advance for any input :)",False,/r/GamingLaptops/comments/1myk47f/help_needed_choosing_software_dev/,GamingLaptops,1756002787.0,0,1.0,Recommendation
1myjpth,https://www.reddit.com/r/Battlefield/comments/1myjpth/what_is_considered_good_fps/,,1,What is considered good FPS?,th3fxr,False,True,False,,False,What is considered a good FPS for BF6 or any game for that matter? Obviously I assume higher is better. I am in need of updating my graphics card with my older processor so im just trying to compare the FPS of certain cards at 1440p and decide what is considered a sweet spot. I would buy a 1440p 144hz monitor at minimum. I was looking at the 4070 or 4070 Super and my processor (5600x) and it appears to get around 80-85fps on Ultra at 1440p. Is this good or mediocre? How different does a game feel from 80 fps to 130 fps particularly in Battlefield 6? Thanks!,False,/r/Battlefield/comments/1myjpth/what_is_considered_good_fps/,Battlefield,1756001543.0,31,0.67,Battlefield 6
1myjmwq,https://i.redd.it/1grt9ueelvkf1.png,,2180,BF6 without the blue filter,Fit-Support2256,False,False,False,"{'images': [{'id': 'IYYbKQafQP0da6LwyzBMEzq7-TUgMIuitUIjGvjxaQ8', 'source': {'url': 'https://preview.redd.it/1grt9ueelvkf1.png?auto=webp&s=d30b0638e88214230b6bcfea77028d89e9bace4e', 'width': 3026, 'height': 1318}, 'variants': {}, 'resolutions': [{'url': 'https://preview.redd.it/1grt9ueelvkf1.png?width=108&crop=smart&auto=webp&s=7b95bc74dbb4d3281a06d2d0bb1b43801618f33d', 'width': 108, 'height': 47}, {'url': 'https://preview.redd.it/1grt9ueelvkf1.png?width=216&crop=smart&auto=webp&s=5dfce5e974bd3489292b26eba7d47ae3b8dd9efc', 'width': 216, 'height': 94}, {'url': 'https://preview.redd.it/1grt9ueelvkf1.png?width=320&crop=smart&auto=webp&s=ab9dbbaf85c4591a620e1ac1e3059e124eb71064', 'width': 320, 'height': 139}, {'url': 'https://preview.redd.it/1grt9ueelvkf1.png?width=640&crop=smart&auto=webp&s=346639271af3c04238925c6f03a6428b12ecdb76', 'width': 640, 'height': 278}, {'url': 'https://preview.redd.it/1grt9ueelvkf1.png?width=960&crop=smart&auto=webp&s=28aba64e0f93a33c59ac563e690121d831797e0f', 'width': 960, 'height': 418}, {'url': 'https://preview.redd.it/1grt9ueelvkf1.png?width=1080&crop=smart&auto=webp&s=53f397a00e2d11c91b63f7fd1a2707045f27b7d9', 'width': 1080, 'height': 470}]}], 'enabled': True}",False,"This is BF6 without the blue/green filter. It looks so much better, it looks so real without it.",False,/r/Battlefield/comments/1myjmwq/bf6_without_the_blue_filter/,Battlefield,1756001294.0,417,0.84,Battlefield 6
1myjmux,https://www.reddit.com/r/nvidia/comments/1myjmux/anyone_else_still_using_an_rtx_2070_super/,,0,Anyone else still using an RTX 2070 SUPER?,ColoradoEric,False,True,False,,False,"I’ve been using this card since 2019 when I purchased my computer. Everything still works good, though I tend to mainly play FPS games where I prefer performance over graphics. Couple of buddy’s found out what card I had when we were playing BF6 beta and they were shocked. Asked why I was still using a 2070 series card in the year 2025 lol. Anyone else? ",False,/r/nvidia/comments/1myjmux/anyone_else_still_using_an_rtx_2070_super/,nvidia,1756001289.0,30,0.42,Discussion
1myjk5e,https://i.redd.it/z3v6lldpkvkf1.jpeg,,6,Advice for Mousepad/Skates,AlMarino,False,False,False,"{'images': [{'id': 'oeS3VKTqY4J7lGIpIjuGIMu_XVt-j5s6cYCRDtCb9Ig', 'source': {'url': 'https://preview.redd.it/z3v6lldpkvkf1.jpeg?auto=webp&s=873575a6fd05f57dbc497211b0b99b214bc5b908', 'width': 3024, 'height': 4032}, 'variants': {}, 'resolutions': [{'url': 'https://preview.redd.it/z3v6lldpkvkf1.jpeg?width=108&crop=smart&auto=webp&s=0fa861e14c12f592137f02617b7c6334c8616bbf', 'width': 108, 'height': 144}, {'url': 'https://preview.redd.it/z3v6lldpkvkf1.jpeg?width=216&crop=smart&auto=webp&s=8d0dc52d690ddf55672cc58c2b56d37dc4e3e7f7', 'width': 216, 'height': 288}, {'url': 'https://preview.redd.it/z3v6lldpkvkf1.jpeg?width=320&crop=smart&auto=webp&s=8a7f92cb9d3809b6db39a71c5388b060f99758bf', 'width': 320, 'height': 426}, {'url': 'https://preview.redd.it/z3v6lldpkvkf1.jpeg?width=640&crop=smart&auto=webp&s=d8ee19d4b81d058b4ea3cd4abcf000ae4a3ed32e', 'width': 640, 'height': 853}, {'url': 'https://preview.redd.it/z3v6lldpkvkf1.jpeg?width=960&crop=smart&auto=webp&s=42a0a7d30cd5556d47133a04d172b134eb91514e', 'width': 960, 'height': 1280}, {'url': 'https://preview.redd.it/z3v6lldpkvkf1.jpeg?width=1080&crop=smart&auto=webp&s=31bfa3978e47eb22717f850ddda777b4ec0452df', 'width': 1080, 'height': 1440}]}], 'enabled': True}",False,"Hi everyone. I got Artisan FX Zero XL Soft today and were using regular QcK XL before. I dont feel much movement difference from before, except it doesn’t feel muddy after an hour or so, am I missing anything ? I am using Viper V3 Pro. Is there any better skates for the mouse for mousepad ? I play singleplayer games, MMOs and BO6 as FPS and BF6 soon. 

Thank you for any input!",False,/r/MousepadReview/comments/1myjk5e/advice_for_mousepadskates/,MousepadReview,1756001058.0,22,0.8,Question/Advice
1myjik1,https://www.reddit.com/r/Battlefield/comments/1myjik1/are_we_ever_gonna_get_an_actual_night_map/,,2,Are we ever gonna get an actual night map ?,XxDarkSasuke69xX,False,True,False,,False,"I've been thinking that it's a shame that dark night time combat and gameplay are most of the time singleplayer only in shooters. How cool would it be if in BF6 there was a map that's in the dark and you need Night vision goggles (or sight) to see properly ? Maybe have buildings on the map that have actual lighting inside so you have to remove the NVGs in them to not be blinded. Flashlights would actually be useful too for once, either to see in the dark or to blind people that have NVGs.

I know that there are ""night"" maps in Battlefield, but they're usually not that dark. Missions with NVGs in campaigns are usually very cool, why is it limited to singleplayer ?

The only issue I see is that people might get bored or annoyed that a lot of the time they have to see in a single color for the duration of the match (green or white). That's why I think only one map or something should be like this. Idk, seems like a cool experience the devs could create, and I haven't really seen this in any other multiplayer game, except maybe Tarkov but that's almost an other genre.",False,/r/Battlefield/comments/1myjik1/are_we_ever_gonna_get_an_actual_night_map/,Battlefield,1756000927.0,6,0.67,Discussion
1myjdss,https://www.reddit.com/r/Battlefield/comments/1myjdss/guided_missiles_should_not_be_fireforget_in_bf6/,,0,Guided Missiles Should Not Be Fire&Forget in BF6,kidseegoats,False,True,False,,False,IMO one should keep the lock through at least some portion of the missiles' flight (like the laser guided missiles in BF4) rather than catching lock once then f&f. ,False,/r/Battlefield/comments/1myjdss/guided_missiles_should_not_be_fireforget_in_bf6/,Battlefield,1756000525.0,2,0.33,Battlefield Labs
1myj7x9,https://i.redd.it/4kgzfhbmhvkf1.jpeg,,396,Humvees for the NATO?,woofi_1,False,False,False,"{'images': [{'id': 'dz1Y1lacC5abA6ZfIwvg-PVkc-9RkR5Ltw4v2ZzBjKY', 'source': {'url': 'https://preview.redd.it/4kgzfhbmhvkf1.jpeg?auto=webp&s=1e5f434cddd7cc716366a2f96eeef8680f816756', 'width': 956, 'height': 678}, 'variants': {}, 'resolutions': [{'url': 'https://preview.redd.it/4kgzfhbmhvkf1.jpeg?width=108&crop=smart&auto=webp&s=34e08cea75a73b84730a66994c1fd74e7fabb3d5', 'width': 108, 'height': 76}, {'url': 'https://preview.redd.it/4kgzfhbmhvkf1.jpeg?width=216&crop=smart&auto=webp&s=cce84d30528d06384a7535a912b828173c3bf2cb', 'width': 216, 'height': 153}, {'url': 'https://preview.redd.it/4kgzfhbmhvkf1.jpeg?width=320&crop=smart&auto=webp&s=74e0f64ba7a7020d2f279033e6dcdcf34a8ab0bc', 'width': 320, 'height': 226}, {'url': 'https://preview.redd.it/4kgzfhbmhvkf1.jpeg?width=640&crop=smart&auto=webp&s=a4d0d216bdc39f52d1fc2244f0f445c65c3085e6', 'width': 640, 'height': 453}]}], 'enabled': True}",False,Unpopular opinion but I think BF6 should have Humvees just like we had in BF3,False,/r/Battlefield6/comments/1myj7x9/humvees_for_the_nato/,Battlefield6,1756000022.0,62,0.94,Discussion
1myj6t4,https://www.reddit.com/r/Battlefield/comments/1myj6t4/bf6_colour_filters_are_back/,,0,BF6 colour filters are back,rcodes987,False,True,False,"{'images': [{'id': 'RtwETSOKT5PVtWMUtHhfE3i4txF5Nq-NvZ78LXaVy5A', 'source': {'url': 'https://external-preview.redd.it/RtwETSOKT5PVtWMUtHhfE3i4txF5Nq-NvZ78LXaVy5A.jpeg?auto=webp&s=ef1736e3b83a60e175f2965d5ce1504982289936', 'width': 480, 'height': 360}, 'variants': {}, 'resolutions': [{'url': 'https://external-preview.redd.it/RtwETSOKT5PVtWMUtHhfE3i4txF5Nq-NvZ78LXaVy5A.jpeg?width=108&crop=smart&auto=webp&s=c7d930a2ec62f7103f0a65790a91fcb00d703677', 'width': 108, 'height': 81}, {'url': 'https://external-preview.redd.it/RtwETSOKT5PVtWMUtHhfE3i4txF5Nq-NvZ78LXaVy5A.jpeg?width=216&crop=smart&auto=webp&s=b56a5eedbb40ef9a60518229d71df1998e65b361', 'width': 216, 'height': 162}, {'url': 'https://external-preview.redd.it/RtwETSOKT5PVtWMUtHhfE3i4txF5Nq-NvZ78LXaVy5A.jpeg?width=320&crop=smart&auto=webp&s=d5bc005c5a1e4eebb3aa94e97293c5cdde8703d9', 'width': 320, 'height': 240}]}], 'enabled': False}",False,"I totally love the ungraded filters or very subtle filters that was there in bf1 ... It looked way more natural.
BF6 is agressively adding these filters which tones down the atmosphere for the game.
Here is the link .... Watch this to understand what I'm talking about.
https://youtu.be/JIJYzFEITX8?si=qDXhOzQhB7gfCMBA",False,/r/Battlefield/comments/1myj6t4/bf6_colour_filters_are_back/,Battlefield,1755999932.0,5,0.45,Battlefield 6
1myj5fm,https://www.reddit.com/gallery/1myj5fm,,4,Servers,Killerwasp1920,False,False,False,,False,A week ago the servers were full globally but now more than half are empty or barley anyone playing I'm in the US and the majority of them are empty but the ones I played recently aren't and I'm not sure if I'm banned or if something happened with servers after the bf6 beta?,False,/r/battlefield_4/comments/1myj5fm/servers/,battlefield_4,1755999820.0,4,0.84,
1myivys,https://www.reddit.com/r/Battlefield/comments/1myivys/bf6_nato_outfits_look_weird/,,0,BF6 NATO outfits look weird,Downtown-Finish9333,False,True,False,,False,They look like airsoft kits. Especially assault with his weird helmet cover that covers the NVG mount. In BF4 they were really grounded and realistic to a certain degree but now they just look off. Like they found pictures of airsofters with MSW with slightly lower quality kits and called it a day. ,False,/r/Battlefield/comments/1myivys/bf6_nato_outfits_look_weird/,Battlefield,1755999017.0,4,0.44,Battlefield 6
1myivjx,https://www.reddit.com/r/Battlefield/comments/1myivjx/played_2042_for_the_first_time/,,3,Played 2042 for the first time,MolassesObjective858,False,True,False,,False,"Steam sale for $3, good timing with the bf6 rewards. And oh man its worse than I thought. The voice lines and actors are the worst ive ever heard in a game. ""I DONT NEED A MEDIC!"" ""I DONT NEED ASSISTANCE!"" Who came up with these corny ass lines? ",False,/r/Battlefield/comments/1myivjx/played_2042_for_the_first_time/,Battlefield,1755998985.0,3,0.71,Battlefield 2042
1myiurf,https://youtu.be/JIJYzFEITX8?si=6tZ4hWMW18qQMxcn,"{'type': 'youtube.com', 'oembed': {'html': '<iframe width=""356"" height=""200"" src=""https://www.youtube.com/embed/JIJYzFEITX8?feature=oembed&enablejsapi=1"" frameborder=""0"" allow=""accelerometer; autoplay; clipboard-write; encrypted-media; gyroscope; picture-in-picture; web-share"" referrerpolicy=""strict-origin-when-cross-origin"" allowfullscreen title=""Why Battlefield 6 Looks Like THAT (De-graded)""></iframe>', 'type': 'video', 'title': 'Why Battlefield 6 Looks Like THAT (De-graded)', 'width': 356, 'height': 200, 'version': '1.0', 'author_url': 'https://www.youtube.com/@Vics_Corner', 'author_name': ""Vic's Corner"", 'provider_url': 'https://www.youtube.com/', 'provider_name': 'YouTube', 'thumbnail_url': 'https://i.ytimg.com/vi/JIJYzFEITX8/hqdefault.jpg', 'thumbnail_width': 480, 'thumbnail_height': 360}}",14,"This guy made a cool video about the ""weird"" color grading in BF6.",rambozezakopan,False,False,False,"{'images': [{'id': 'RtwETSOKT5PVtWMUtHhfE3i4txF5Nq-NvZ78LXaVy5A', 'source': {'url': 'https://external-preview.redd.it/RtwETSOKT5PVtWMUtHhfE3i4txF5Nq-NvZ78LXaVy5A.jpeg?auto=webp&s=ef1736e3b83a60e175f2965d5ce1504982289936', 'width': 480, 'height': 360}, 'variants': {}, 'resolutions': [{'url': 'https://external-preview.redd.it/RtwETSOKT5PVtWMUtHhfE3i4txF5Nq-NvZ78LXaVy5A.jpeg?width=108&crop=smart&auto=webp&s=c7d930a2ec62f7103f0a65790a91fcb00d703677', 'width': 108, 'height': 81}, {'url': 'https://external-preview.redd.it/RtwETSOKT5PVtWMUtHhfE3i4txF5Nq-NvZ78LXaVy5A.jpeg?width=216&crop=smart&auto=webp&s=b56a5eedbb40ef9a60518229d71df1998e65b361', 'width': 216, 'height': 162}, {'url': 'https://external-preview.redd.it/RtwETSOKT5PVtWMUtHhfE3i4txF5Nq-NvZ78LXaVy5A.jpeg?width=320&crop=smart&auto=webp&s=d5bc005c5a1e4eebb3aa94e97293c5cdde8703d9', 'width': 320, 'height': 240}]}], 'enabled': False}",False,I really prefer his version. I know what devs were trying to do but I think its a bit too much. These maps are really beautifull but these filters arent doing them any good,False,/r/Battlefield/comments/1myiurf/this_guy_made_a_cool_video_about_the_weird_color/,Battlefield,1755998911.0,11,0.62,Battlefield 6
1myihnz,https://www.reddit.com/r/ryzen/comments/1myihnz/5600_am5/,,3,5600 -> am5,Evering9,False,True,False,,False,"Hi, I wanna upgrade my cpu.
My current specs are:

CPU r5 5600
GPU rx9060xt
Ddr4 32gb ram 
8 years old 600w psu

I have hard times deciding between 7500f or 7800x3d. I play a lot of games like the finals, bf6 but also cyberpunk, horizon. 

Idk is 0.1% lows that much difference?

Ofc looking to upgrade gpu somday.
",False,/r/ryzen/comments/1myihnz/5600_am5/,ryzen,1755997808.0,11,1.0,
1myhhfk,https://www.reddit.com/r/PcBuild/comments/1myhhfk/what_would_be_better/,,1,What would be better?,realtrealmeal,False,True,False,,False,"Im deciding on two options for my pc build im buying/building this week. Im either picking a 7600x3d with a 9060xt 16gb or a 7600x paired with a 5070. I play LoL and in the future BF6, which is better for performance?",False,/r/PcBuild/comments/1myhhfk/what_would_be_better/,PcBuild,1755994798.0,2,1.0,Question
