id,url,media,score,title,author,edited,is_self,over_18,preview,spoiler,selftext,stickied,permalink,subreddit,created_utc,num_comments,upvote_ratio,link_flair_text
1mysb1i,https://i.redd.it/vkgpnsnw4ykf1.jpeg,,16,option to set kill feed to the center,Positive_Doubt_9084,False,False,False,"{'images': [{'id': 'vuRdI17VABmOjfLsdt6vV8u_MDRbP7jRzacdK1vLnRc', 'source': {'url': 'https://preview.redd.it/vkgpnsnw4ykf1.jpeg?auto=webp&s=54dc041f4865f5e7847a9bf9f79a78e783db6cde', 'width': 889, 'height': 806}, 'variants': {}, 'resolutions': [{'url': 'https://preview.redd.it/vkgpnsnw4ykf1.jpeg?width=108&crop=smart&auto=webp&s=e1799fcbfafa320187a8d1fa2a51f233d76dddae', 'width': 108, 'height': 97}, {'url': 'https://preview.redd.it/vkgpnsnw4ykf1.jpeg?width=216&crop=smart&auto=webp&s=383ba423db459a6d3ba757baa1878f86b5f9a501', 'width': 216, 'height': 195}, {'url': 'https://preview.redd.it/vkgpnsnw4ykf1.jpeg?width=320&crop=smart&auto=webp&s=639d149c68fda0e784eef16f1ed3e2e92137584a', 'width': 320, 'height': 290}, {'url': 'https://preview.redd.it/vkgpnsnw4ykf1.jpeg?width=640&crop=smart&auto=webp&s=b53f44cc617dbd710f50a09e2b755eed95df1148', 'width': 640, 'height': 580}]}], 'enabled': True}",False,I personally like BF6 kill feed but I feel an option to center it in the middle like the old games would be amazing. ,False,/r/Battlefield/comments/1mysb1i/option_to_set_kill_feed_to_the_center/,Battlefield,1756032066.0,3,0.94,Battlefield 6
1mysa16,https://www.reddit.com/r/Battlefield/comments/1mysa16/auto_healing_in_bf6/,,404,Auto healing in BF6.,n1sx,False,True,False,,False,After playing some previous BF games it made me realize how fast self healing in BF6 was. Like we go from 1HP to 100 in 2-3 seconds. IMO thats way too fast and kinda defeats the purpose of being a support class.,False,/r/Battlefield/comments/1mysa16/auto_healing_in_bf6/,Battlefield,1756031968.0,150,0.89,Battlefield 6
1mys434,/r/Battlefield/comments/1mys3lz/with_the_amount_of_destruction_in_bf6_im_amazed/,,148,With the amount of destruction in BF6 im amazed that they didn't brought the fortification system from BF5.,n1sx,False,False,False,,False,,False,/r/Battlefield6/comments/1mys434/with_the_amount_of_destruction_in_bf6_im_amazed/,Battlefield6,1756031376.0,42,0.95,Discussion
1mys3lz,https://www.reddit.com/r/Battlefield/comments/1mys3lz/with_the_amount_of_destruction_in_bf6_im_amazed/,,105,With the amount of destruction in BF6 im amazed that they didn't brought the fortification system from BF5.,n1sx,False,True,False,,False,"I've been thinking... BF6's map destruction was the best opportunity for DICE to reintroduce the fortification system from BF5. It would make a lot of sense for the engineer class to be able to repair and build different types of fortifications/ramps/bridges across the map.

Imagine a scenario where someone blows up a house. As an engineer, you go in and quickly build up some sandbag walls so your teammates can use them as cover.

On top of that, I'm really not a huge fan of Support's tiny placeable wall...",False,/r/Battlefield/comments/1mys3lz/with_the_amount_of_destruction_in_bf6_im_amazed/,Battlefield,1756031328.0,33,0.91,Battlefield 6
1myrrno,https://www.reddit.com/r/Battlefield/comments/1myrrno/2042_is_still_a_trash_game/,,0,2042 is still a trash game,JoeZocktGames,False,True,False,,False,"I was wondering what is happening in r/battlefield2042. So much praise for the game recently and I was like ""do we play the same game, especially after the BF6 beta?""

Maps are fucking horrendous. So many of them are literally just barren, empty spaces, even the smaller 64 player versions. Especially the desert maps like Hourglass, El Alamein and Discarded. There is ZERO cover between capture points.

And this leads me to my next point: The TOR tank. Yep, this thing, depsite its ""nerf"", is game breaking in my opinion. Not only is it a shit concept, but it's also frustrating. You want to transport people with your MAV or Brawler around? Good luck with a TOR camping on a hill on El Alamein overlooking the entire map. Yep, I got killed multiple times over the weekend by these players. And the best thing is, they don't even have to leave their safe space aka the HQ, so not much you can do. Helicopter? Forget it, a Wildcat is sitting right next to it and some dudes as well who repair both. Peak gameplay.

  
Also so many other garbage concepts like Liz with her stupid TV missile, often getting kills without even needing line of sight. Wonderful.

Nah man, don't let people tell you this is a ""good game"" by now. **It is a fixed, functional game**. But a garbage game nontheless. The only reason I play this steaming pile of shit are the BF6 rewards. It is fucking torture.",False,/r/Battlefield/comments/1myrrno/2042_is_still_a_trash_game/,Battlefield,1756030147.0,72,0.5,Battlefield 2042
1myrpma,https://www.reddit.com/r/Battlefield/comments/1myrpma/help_needed_my_game_is_not_launching_after_bf6/,,1,Help needed my game is not launching after bf6.,Hour-Particular-228,False,True,False,,False,"Hi everyone, after downloading bf6 my bf2042 is not launching. I uninstall and install 2 times and clicked to repair like 6 times but no luck.

Game shuts down at loading screen and i get a notification as ""Your game failed to launch an error on our end""

I am using EA app. I did a ticked on the issue but they didn't answer me still after  2 weeks. Need help",False,/r/Battlefield/comments/1myrpma/help_needed_my_game_is_not_launching_after_bf6/,Battlefield,1756029939.0,2,0.6,Battlefield 2042
1myr349,https://www.reddit.com/r/DeltaForceGlobal/comments/1myr349/incase_youre_like_me_and_have_either_not_been/,,1,"Incase you're like me and have either not been able to redeem the Twitch Drops and/or Support has been a useless bunch of bots - Telling someone on console to use the ""in game support system'.. Follow these steps to get your rewards!",Burkely31,False,True,False,,False,"#     MODS: If this Post is an issue, or somehow goes against some sort of Rule I didn't see, I apologize! I'm simply trying to help those who have yet to be able to redeem their rewards before the cut off date tomorrow, August 25/25



So, I've basically reached my witts end with the countless back and forth with the Support Bots - I mean Team? I guess?? Regarding not being able to connect my DF account to twitch, in order to redeem the Drops via twitch viewership rewards.

  At first, I was told to follow the steps on this page by somone in the discord (I believe, or may have been a bot via email) - [https://www.playdeltaforce.com/act/twitchdrops/index.html#:\~:text=STEP%201,WATCH%20NOW](https://www.playdeltaforce.com/act/twitchdrops/index.html#:~:text=STEP%201,WATCH%20NOW)

  
At the very bottom of the page, it mentions under #6. ""How to Unbind My Account"" - to hit the unbind  button at the top of the page. Unfortunately, said button does not exist! I've been doing the whole Twitch drop thing for ages, and I've never encountered a clusted ""mess"" quite like this. Usually, it's as simple as logging into Twitch, going to ""connections"" under your settings. From there, you look for the specific Developer you want to remove from having a connection for you Twitch account. 

  
  Unforutnately,  for myself and what seems like countless others - these steps simple don't work, What's worse it's as if the Developers or rather folks in charge of the technical end of things over at Delta Force somehow managed to mangle the connection between loads of accounts and twitch in such a way that it's not even possible to claim these rewards under your normal twitch account. 

  
  However, I found a fix! I'll add screenshots, taken in the last hour or two that prove this process does indeed work. It's worth noting, that the entire time, my ""own"" twitch accoint that is many years old is and was at the time of redeeming these drops via a second account, connected to ""Delta Force App"". 

  
  ***What you need to do to get your drops on to your account:***

*    First off, you'll need to create a fresh Twitch account.  ***I would recommend using A. a different browser, but not a VPN - seems DF's website doesn't like it when you sign in with a VPN!***
*   Now, unfortunately, I'm not sure whether this process is random or what - however, you may be required to use a second phone number to set up this twitch account. You could always explain to a family member what the situation is and ask if you cna use there's. There are also services out there, reputable ones, that provide a legit texting service for these exact situations.
*   Once this twitch account is created, just tune into some random streamer or you favorite streamer who currently has ""Drops Enabled"". Once two hours of having the stream sit has passed, you've now qualified for the 9 or so drops.
*  
*   At this point,  in the same browser, I'd recommend opening a new tab and logging into your main twitch account, the one you originally used to try and get these drops, under settings you want to look for connections and then just press CTRL+F and type Delta - You'll see ""**Delta Force App"". You want  to Disconnect! (To be fair, my account is still connected to not only my main twitch account where i had issues, but also my new/secondary account and they are still both connected. You  may be able to skip this step but likely best to take the time and do the couple extra steps!).** 

*   \*\*\* You'll want to make sure that before you click on ""Connect"" (show on the the left hand side of the list of drops, you do indeed have an account setup @ Delta Forces ""Level Infitite"" Webiste - [https://pass.levelinfinite.com/](https://pass.levelinfinite.com/) (Confusing, right? Yeah. I don't get it either!!! But I believe this is the Developers way of keeping one website for signins for all their games, who knows...). Furthermore, since this developer doesn't have their website setup properly for console players to sign in using the PSN or Xbox accounts (like most developers out there), I feel it's very important that the email used to sign in to your delta force account is the ***SAME email address used on your PSN/Xbox (MS LIVE???) account.*** Something tells me that this is rather imperative, and not something we can just chose not to do! I could be wrong though!!! \*\*\*\*\*
* Also, fair warning - On the level infinite website, I personally do not do the whole enter my email address and then enter the code they send to that email address in order to sign in, Instead, I prefer to chose the ""Login with email and password"" option, I've found it to give me less issues, specifically when trying to redeem these drops!
*   Once logged in, switch back over to the twitch drops page, click ""Connect"" or you can likely just click on ""Claim"" on one of the items you're trying to redeem! You should now be looking at the DF page, [https://www.playdeltaforce.com/act/twitchdrops/index.html](https://www.playdeltaforce.com/act/twitchdrops/index.html) where you should see your email that you signed in with, only some/most of it with have \*\*\* blocking the personal info on screen. Now, you can simply click on ""Step #2"" which will redirect you to a twitch page, asking permission to connect the ""Delta Force App"" to your account. Accept that.
*   After you've completed all those steps, which to be fair, isn't as bad as I make it out to be - you should now either have possibly redeemed all drops by click ""claim"" and the connecting the account or it's possible you now need need to claim each individually! Give it about 5-10 minutes, boot up or restart your game and check the mailbox. You should have confirmation of the Twitch Drops being added to your account. 
*   **HOWEVER, YOU AREN'T DONE YET: Incase you havne't realized, this game seems to love to make us work for these rewards. So make sure you go through each of the messages and ""Claim"" the rewards!**

  
   Thats it! Hopefully tis worked for you like it did for me! A bit irritating to say the least and absolutely frustrating that we've been forced to go trhough this sort of thing just to get a couple twitch drops. If you ask me, if they weren't ready for Console Support, they should have waited! But that's a whole other topic!



https://preview.redd.it/4y4m8bqyqxkf1.png?width=775&format=png&auto=webp&s=4521fae78f76ad0c266dfc27a1f7543ac48afa57

https://preview.redd.it/zj2ekjh2rxkf1.png?width=1723&format=png&auto=webp&s=03bc484fd65ece4cb7e002a6ed6b1a1a492f5f39

https://preview.redd.it/wavmt0y3rxkf1.png?width=1338&format=png&auto=webp&s=f54350a9ed0546e49fcb588de8de9277970b7840

https://preview.redd.it/45s1dom5rxkf1.jpg?width=1540&format=pjpg&auto=webp&s=93eee760357355a712b5a7b785638920c23c04d4

https://preview.redd.it/erqgofz6rxkf1.jpg?width=3582&format=pjpg&auto=webp&s=90d5e399f541a65fcfb10d224d214e61e9737e9a

",False,/r/DeltaForceGlobal/comments/1myr349/incase_youre_like_me_and_have_either_not_been/,DeltaForceGlobal,1756027606.0,0,1.0,Discussion 🗣️
1myqxss,https://www.reddit.com/r/pcmasterrace/comments/1myqxss/quel_est_le_meilleur_cpu_pour_une_4090/,,0,Quel est le meilleur cpu pour une 4090 ?,StevannFr,False,True,False,,False,"Bonjour,

j'ai actuellement un 12700k avec ma suprim x liquid et je joue en 4k, j'ai pu remarqué que dans certain jeu mon 12700k bride ma 4090 et meme en 4k .... (bf6, kingdome come 2 etc...)

selon vous quel est le meilleur cpu pour que ma 4090 puisse manger a sa faim ?

Merci a vous.",False,/r/pcmasterrace/comments/1myqxss/quel_est_le_meilleur_cpu_pour_une_4090/,pcmasterrace,1756027042.0,12,0.33,Hardware
1myqxjx,https://www.reddit.com/r/Battlefield/comments/1myqxjx/hot_take_removing_bf6s_filters_makes_it_look_like/,,2,Hot take: Removing BF6’s filters makes it look like Generic FPS #738,Spoggi99,False,True,False,,False,"I don’t want to beat a dead horse, but I’ve noticed that the loudest voices are always the ones complaining (especially on r/Battlefield). So I wanted to add a different perspective to the discussion and I guess I’m not the only one who actually likes the Battlefield 6 filters.

I don’t want the game to feel like just another generic realistic FPS shooter. I want it to feel like Battlefield 6.

Same thing with BF3. It might not look realistic in terms of color grading, but it feels like BF3. Every time I come back to it, I get the same feeling I had when I first played it all those years ago.

Nowadays, everything has to look as realistic as possible and honestly, I think that sucks the soul out of a lot of games and movies. It all starts to blur together. The BF6 filters give the game style, identity, and atmosphere. I’d rather have a game with a strong visual direction than one that looks like a tech demo.

Sure, you can add a toggle in the menus but please don’t remove them.",False,/r/Battlefield/comments/1myqxjx/hot_take_removing_bf6s_filters_makes_it_look_like/,Battlefield,1756027018.0,28,0.51,Battlefield 6
1myqrfo,https://i.redd.it/48pivwo0oxkf1.jpeg,,0,How to solve the BF6 blue filter problem,Positive_Doubt_9084,False,False,False,"{'images': [{'id': 'BSqfh69WqXKplYOy8mVetixZaxn5hrAcaaK48tJY3k0', 'source': {'url': 'https://preview.redd.it/48pivwo0oxkf1.jpeg?auto=webp&s=bc0c220419099b1fa8168a3689de0658475eec3c', 'width': 1440, 'height': 993}, 'variants': {}, 'resolutions': [{'url': 'https://preview.redd.it/48pivwo0oxkf1.jpeg?width=108&crop=smart&auto=webp&s=b09fe18f494f21e61142c3a03a86639fa16493e3', 'width': 108, 'height': 74}, {'url': 'https://preview.redd.it/48pivwo0oxkf1.jpeg?width=216&crop=smart&auto=webp&s=f6a66f8d5be460e15a58ec838797b7f911155e08', 'width': 216, 'height': 148}, {'url': 'https://preview.redd.it/48pivwo0oxkf1.jpeg?width=320&crop=smart&auto=webp&s=2e8500719f18797c6497c53bf5af4a9a6a4431b2', 'width': 320, 'height': 220}, {'url': 'https://preview.redd.it/48pivwo0oxkf1.jpeg?width=640&crop=smart&auto=webp&s=47cffd0b1d9cc6ea279efc8564980facd59ef9cd', 'width': 640, 'height': 441}, {'url': 'https://preview.redd.it/48pivwo0oxkf1.jpeg?width=960&crop=smart&auto=webp&s=60e7ddf3b434b7824dfcc0c356fe1d210465fca6', 'width': 960, 'height': 662}, {'url': 'https://preview.redd.it/48pivwo0oxkf1.jpeg?width=1080&crop=smart&auto=webp&s=05103281cd5f332a2f1b3bd1890db3c4d65fd644', 'width': 1080, 'height': 744}]}], 'enabled': True}",False,I saw this in a comment section and I think it makes sense honestly. Let one of the maps per location have the filter while the other doesn't. This will actually bring heavy variety between maps while both sides can be happy.,False,/r/Battlefield/comments/1myqrfo/how_to_solve_the_bf6_blue_filter_problem/,Battlefield,1756026386.0,9,0.18,Battlefield 6
1myqhus,https://www.reddit.com/r/buildapc/comments/1myqhus/new_cpu_for_3080ti_1440p/,,0,New cpu for 3080ti 1440p.,Cheesus_H_Crust_,False,True,False,,False,"Hello, i havent really played games for a few years, but with the new GTA and BF6 comming out soon i'd like to play some whenever i find the time.

My cpu is old, 9600k @ 5ghz, so it's time for an upgrade. I am completely clueless about CPU's, motherboards and ram.

I was looking at intel 14700k, should be abit future proof incase i want a new GPU aswell?

I was thinking about spending around 1k usd, any recomendations? For CPU, motherboard and ram.",False,/r/buildapc/comments/1myqhus/new_cpu_for_3080ti_1440p/,buildapc,1756025358.0,7,0.33,Build Help
1myqftc,https://www.reddit.com/r/pcmasterrace/comments/1myqftc/bios_update_error_cold_boot/,,0,BIOS update Error & Cold Boot,Ei8ht_,False,True,False,,False,"Built this PC in 2021



My PC has been having this weird problem wherein when I cold boot the pc, everything will switch on, fans will run, including the CPU cooler fan case fans, and the GPU fan. The monitor will show power saving mode and go into sleep mode. There is a white debug light against the CPU. But if I wait for 30 seconds and cut the power off and boot it again, the PC boots into Windows. Sometimes this shutting down happens while the PC is in use.

I asked for help from ChatGPT, and it recommended updating the BIOS because there has been an issue regarding cold boot. Updated to March 2025 BIOS, updated from the 2021 update, which was on the board previously. I tried to update it to the 2025-05-12 version 7C56vAJ, but it's only updating to the March version I installed.



PC Specs :

Ryzen 5 5600x

MSI B550 A- Pro

XPG 16 GB RAM 3200mhz

MSI 3060 12 GB

Cooler Master MWE 650 V2 80+ Bronze

OS Win 10

Things I have tried till now:

Updated the Graphics driver and rolled back as well because I thought it may be a graphics issue

Driver Version 576.52

Had switched on Secure boot and TPM for BF6, rolled it back with clear CMOS",False,/r/pcmasterrace/comments/1myqftc/bios_update_error_cold_boot/,pcmasterrace,1756025142.0,1,0.5,Tech Support
1myqe8l,https://www.reddit.com/r/MSI_Gaming/comments/1myqe8l/bios_update_error_cold_boot/,,2,BIOS update Error & Cold Boot,Ei8ht_,False,True,False,,False,"Built this PC in 2021

My PC has been having this weird problem wherein when I cold boot the pc, everything will switch on, fans will run, including the CPU cooler fan case fans, and the GPU fan. The monitor will show power saving mode and go into sleep mode. There is a white debug light against the CPU. But if I wait for 30 seconds and cut the power off and boot it again, the PC boots into Windows. Sometimes this shutting down happens while the PC is in use.

I asked for help from ChatGPT, and it recommended updating the bios because there has been an issue regarding cold boot. Updated to March 2025 BIOS, updated from the 2021 update, which was on the board previously. I tried to update it to the 2025-05-12 version 7C56vAJ, but it's only updating to the March version I installed.

PC Specs :  
Ryzen 5 5600x  
MSI B550 A- Pro  
XPG 16 GB RAM 3200mhz  
MSI 3060 12 GB  
Cooler Master MWE 650 V2 80+ Bronze  
OS Win 10

Things I have tried till now:

Updated the Graphics driver and rolled back as well because I thought it may be a graphics issue  
Driver Version 576.52  
Had switched on Secure boot and TPM for BF6, rolled it back with clear CMOS",False,/r/MSI_Gaming/comments/1myqe8l/bios_update_error_cold_boot/,MSI_Gaming,1756024979.0,0,1.0,Troubleshooting
1myqd3p,https://www.reddit.com/r/Battlefield6/comments/1myqd3p/rocketman_ragdoll_is_definitely_oldschool/,,1,Rocket-man ragdoll is definitely old-school,Existing-Prize7585,False,True,False,,False,"I remember characters flying on impact during BF6 beta, here is the clip I've got in BF4 yesterday

https://reddit.com/link/1myqd3p/video/zyg7c2fbjxkf1/player

",False,/r/Battlefield6/comments/1myqd3p/rocketman_ragdoll_is_definitely_oldschool/,Battlefield6,1756024858.0,0,1.0,Meme
1myq8te,https://v.redd.it/qgwd0621ixkf1,"{'reddit_video': {'width': 480, 'height': 264, 'is_gif': False, 'hls_url': 'https://v.redd.it/qgwd0621ixkf1/HLSPlaylist.m3u8?a=1758646801%2CNWU2ODVkNzQ1Mzg3ZmEzYzJiNTc3YjFjZjA2MTc5NDBmM2RlMjBmMjc2MGI2ZGUwNWQxZjY3ZjE4NmYyNTY4Mw%3D%3D&v=1&f=sd', 'dash_url': 'https://v.redd.it/qgwd0621ixkf1/DASHPlaylist.mpd?a=1758646801%2COTM2ZTg5ZGRlZjMyNjgzNzU0NTY1MjI2MTQ4NWMwYzU5MzA2NzZkOGI1NWU5MTkxZWZmNDQyY2Q3ZTZiYThlZA%3D%3D&v=1&f=sd', 'duration': 6, 'has_audio': False, 'bitrate_kbps': 450, 'fallback_url': 'https://v.redd.it/qgwd0621ixkf1/DASH_270.mp4?source=fallback', 'scrubber_media_url': 'https://v.redd.it/qgwd0621ixkf1/DASH_96.mp4', 'transcoding_status': 'completed'}}",1,POTATOED: Battlefield 6 Tank & RPG Gameplay 😱 Below Minimum Requirements #bf6 #Battlefield6,sixburn,False,False,False,"{'images': [{'id': 'MnRrMXQ2MjFpeGtmMW4pfzK0yE4G7e6VisX0sQMDQqY15gsGoTxTd_g-tp8O', 'source': {'url': 'https://external-preview.redd.it/MnRrMXQ2MjFpeGtmMW4pfzK0yE4G7e6VisX0sQMDQqY15gsGoTxTd_g-tp8O.png?format=pjpg&auto=webp&s=c22a8521772110b0c317a326545c9e583b261c6e', 'width': 480, 'height': 264}, 'variants': {}, 'resolutions': [{'url': 'https://external-preview.redd.it/MnRrMXQ2MjFpeGtmMW4pfzK0yE4G7e6VisX0sQMDQqY15gsGoTxTd_g-tp8O.png?width=108&crop=smart&format=pjpg&auto=webp&s=bdf2f2c3724b8a7c499a89d9d9c7d75b6ce69777', 'width': 108, 'height': 59}, {'url': 'https://external-preview.redd.it/MnRrMXQ2MjFpeGtmMW4pfzK0yE4G7e6VisX0sQMDQqY15gsGoTxTd_g-tp8O.png?width=216&crop=smart&format=pjpg&auto=webp&s=76ff21f6d77ccf39a054f52075eb0124ddf93211', 'width': 216, 'height': 118}, {'url': 'https://external-preview.redd.it/MnRrMXQ2MjFpeGtmMW4pfzK0yE4G7e6VisX0sQMDQqY15gsGoTxTd_g-tp8O.png?width=320&crop=smart&format=pjpg&auto=webp&s=773faf5073cc4ba366db55918523252b3a3faa0b', 'width': 320, 'height': 176}]}], 'enabled': False}",False,Watch → [https://youtu.be/RNJK0z2Y\_E0](https://youtu.be/RNJK0z2Y_E0) ,False,/r/u_sixburn/comments/1myq8te/potatoed_battlefield_6_tank_rpg_gameplay_below/,u_sixburn,1756024397.0,0,1.0,
1myq6s4,https://i.redd.it/5nuz51j8hxkf1.png,,0,Video on the Colour grading in BF6 deserves more eyes,R4wden,False,False,False,"{'images': [{'id': 'nXdhKDfUoHJ9Zb5-kmPoSxwxsEX7UciARzaav5PUYHE', 'source': {'url': 'https://preview.redd.it/5nuz51j8hxkf1.png?auto=webp&s=696b60e068ecc8c0ed211e82f55d948ed7d9377d', 'width': 1812, 'height': 1364}, 'variants': {}, 'resolutions': [{'url': 'https://preview.redd.it/5nuz51j8hxkf1.png?width=108&crop=smart&auto=webp&s=a9d536d4e37c32cdf78e35ae01d0cfcdc14089c7', 'width': 108, 'height': 81}, {'url': 'https://preview.redd.it/5nuz51j8hxkf1.png?width=216&crop=smart&auto=webp&s=511ff0bd58c8de8148de8e191f37dc437227f59c', 'width': 216, 'height': 162}, {'url': 'https://preview.redd.it/5nuz51j8hxkf1.png?width=320&crop=smart&auto=webp&s=4c43e59ad1d0046f1ea0fd779136151d8349e041', 'width': 320, 'height': 240}, {'url': 'https://preview.redd.it/5nuz51j8hxkf1.png?width=640&crop=smart&auto=webp&s=555475cd4d399e78dcddddac92f73bd9aed722c6', 'width': 640, 'height': 481}, {'url': 'https://preview.redd.it/5nuz51j8hxkf1.png?width=960&crop=smart&auto=webp&s=5d0009ea552441a8122918379e0d78e4b7d0646c', 'width': 960, 'height': 722}, {'url': 'https://preview.redd.it/5nuz51j8hxkf1.png?width=1080&crop=smart&auto=webp&s=e6e7393a5e3c41e3befa8feda0c59f355a75a559', 'width': 1080, 'height': 812}]}], 'enabled': True}",False,,False,/r/Battlefield6/comments/1myq6s4/video_on_the_colour_grading_in_bf6_deserves_more/,Battlefield6,1756024177.0,1,0.29,Discussion
