id,url,media,score,title,author,edited,is_self,over_18,preview,spoiler,selftext,stickied,permalink,subreddit,created_utc,num_comments,upvote_ratio,link_flair_text
1mz0kx6,https://i.redd.it/870hlblhxzkf1.png,,2,Made a chart showcasing every playable vehicle in Battlefield 6 multiplayer,ToaMandalore,False,False,False,"{'images': [{'id': 'v_5RWjP_RseWUtOj28OsgYC8ngnTJeUtdZ0juYTLc6c', 'source': {'url': 'https://preview.redd.it/870hlblhxzkf1.png?auto=webp&s=ed1921860bead9d3b8d619de6b5d8a054bc6b61e', 'width': 1280, 'height': 2520}, 'variants': {}, 'resolutions': [{'url': 'https://preview.redd.it/870hlblhxzkf1.png?width=108&crop=smart&auto=webp&s=089b156ab3ef54b352e104c23a2d02009533dddb', 'width': 108, 'height': 212}, {'url': 'https://preview.redd.it/870hlblhxzkf1.png?width=216&crop=smart&auto=webp&s=63de1bee439b7b62a9dfbf02060d94a163bb12a9', 'width': 216, 'height': 425}, {'url': 'https://preview.redd.it/870hlblhxzkf1.png?width=320&crop=smart&auto=webp&s=121902d7ebc81fca9c28300a9a95f25a4e2a504e', 'width': 320, 'height': 630}, {'url': 'https://preview.redd.it/870hlblhxzkf1.png?width=640&crop=smart&auto=webp&s=b5026008a241dceb012eb7d4879adb2da40be374', 'width': 640, 'height': 1260}, {'url': 'https://preview.redd.it/870hlblhxzkf1.png?width=960&crop=smart&auto=webp&s=5917c68b93044bd78796684443159573e9804bda', 'width': 960, 'height': 1890}, {'url': 'https://preview.redd.it/870hlblhxzkf1.png?width=1080&crop=smart&auto=webp&s=126aca54cbcc71944d02862a286ce12eabce1565', 'width': 1080, 'height': 2126}]}], 'enabled': True}",False,"Saw a lot of people seemingly still confused about what vehicles will be playable in BF6, leading to complaints such as both factions using the same the same tanks and jets. So I made a chart which shows all known vehicles that we can expect to appear either at launch or as part of the first season.



Sources are the open beta, promotianal footage released by EA, and credible leaks.",False,/r/Battlefield/comments/1mz0kx6/made_a_chart_showcasing_every_playable_vehicle_in/,Battlefield,1756053826.0,0,1.0,Battlefield 6
1mz0203,https://www.reddit.com/r/battlefield2042/comments/1mz0203/whats_your_favorite_class_andor_specialist/,,1,What’s your favorite class and/or specialist?,BurningSun7,False,True,False,,False,"What’s your favorite class and/or specialist?

For me it’s support, specifically Falck. I’m a team player most of the time and I like to revive people to help keep pushing the objective. I’m probably going to be mainly using Falck until BF6 comes out.",False,/r/battlefield2042/comments/1mz0203/whats_your_favorite_class_andor_specialist/,battlefield2042,1756052639.0,2,1.0,Discussion
1myzevz,https://www.reddit.com/gallery/1myzevz,,149,BF6 Alpha & Beta Graphics Comparison,Zibe3zooooh,False,False,False,,False,,False,/r/Battlefield/comments/1myzevz/bf6_alpha_beta_graphics_comparison/,Battlefield,1756051223.0,73,0.95,Battlefield 6
1myzb97,https://www.reddit.com/r/Battlefield6/comments/1myzb97/hardcore_mode/,,2,Hardcore mode,Askekrakk,False,True,False,,False,"I hope there will be a fixed Hardcore mode in BF6 akin to that in 2042.

Anyone know if this will be a thing?",False,/r/Battlefield6/comments/1myzb97/hardcore_mode/,Battlefield6,1756050989.0,2,1.0,Question
1myz5tm,https://i.redd.it/ikqcxkb2ozkf1.png,,1,"I'm thinking we're 100% getting classic outfits in BF6. Messing around in Portal with 2042, and it's honestly so sick to see the legendary soldier models with modern rendering. Seems like a waste to have these laying around and never use them again.",Kyvix2020,False,False,False,"{'images': [{'id': 'Ka5j-3bNEFrhTJyVdde_PvfIUsaSTuRkpjpICqqflxY', 'source': {'url': 'https://preview.redd.it/ikqcxkb2ozkf1.png?auto=webp&s=f788d002dbd00dd4f459dfc6d9d445218d7b9e7f', 'width': 1671, 'height': 725}, 'variants': {}, 'resolutions': [{'url': 'https://preview.redd.it/ikqcxkb2ozkf1.png?width=108&crop=smart&auto=webp&s=6f916625274639f51f890c21df286b108a021c98', 'width': 108, 'height': 46}, {'url': 'https://preview.redd.it/ikqcxkb2ozkf1.png?width=216&crop=smart&auto=webp&s=e53e6efbb869e663d5e198bc1af5dfdd73deb50f', 'width': 216, 'height': 93}, {'url': 'https://preview.redd.it/ikqcxkb2ozkf1.png?width=320&crop=smart&auto=webp&s=b4f204ddca076a39ed387eff0d2394735d9d22b8', 'width': 320, 'height': 138}, {'url': 'https://preview.redd.it/ikqcxkb2ozkf1.png?width=640&crop=smart&auto=webp&s=4b0f7c1880e1861039686dbfaa33f5511b32ff5a', 'width': 640, 'height': 277}, {'url': 'https://preview.redd.it/ikqcxkb2ozkf1.png?width=960&crop=smart&auto=webp&s=f12c8a3301e23cf55ac6e74f5e6288c975fe3006', 'width': 960, 'height': 416}, {'url': 'https://preview.redd.it/ikqcxkb2ozkf1.png?width=1080&crop=smart&auto=webp&s=6de919a2d73308740f73798c52b9ee9a9bcdcb83', 'width': 1080, 'height': 468}]}], 'enabled': True}",False,,False,/r/Battlefield/comments/1myz5tm/im_thinking_were_100_getting_classic_outfits_in/,Battlefield,1756050637.0,0,1.0,Battlefield 6
1myz0p4,https://i.redd.it/ffwhgyizmzkf1.jpeg,,111,Waiting on BF6 like,HellhoundXIV,False,False,False,"{'images': [{'id': 'IQHWIcka8BwAlZBXedkam4bHuN2_eKCfqqSAxCV-SxE', 'source': {'url': 'https://preview.redd.it/ffwhgyizmzkf1.jpeg?auto=webp&s=5b21ea74736f13a949cc25768a681c268e055f29', 'width': 670, 'height': 660}, 'variants': {}, 'resolutions': [{'url': 'https://preview.redd.it/ffwhgyizmzkf1.jpeg?width=108&crop=smart&auto=webp&s=d4e25d3470a1beabde6a8c3b340278b4f425e5fd', 'width': 108, 'height': 106}, {'url': 'https://preview.redd.it/ffwhgyizmzkf1.jpeg?width=216&crop=smart&auto=webp&s=94880d291511b4eb854028e21ebbf0c68d1223db', 'width': 216, 'height': 212}, {'url': 'https://preview.redd.it/ffwhgyizmzkf1.jpeg?width=320&crop=smart&auto=webp&s=1c3a3244bc5ac0e6fae79e1230322c9d0d292e00', 'width': 320, 'height': 315}, {'url': 'https://preview.redd.it/ffwhgyizmzkf1.jpeg?width=640&crop=smart&auto=webp&s=03f2fdd8917a306ff32cb3b18d148e52f95164be', 'width': 640, 'height': 630}]}], 'enabled': True}",False,"And here we are, suffering in 2042 for some BF6 skins...",False,/r/Battlefield/comments/1myz0p4/waiting_on_bf6_like/,Battlefield,1756050307.0,15,0.89,Battlefield 6
1myyquj,https://v.redd.it/ytddwvhgkzkf1,"{'reddit_video': {'width': 1920, 'height': 1080, 'is_gif': False, 'hls_url': 'https://v.redd.it/ytddwvhgkzkf1/HLSPlaylist.m3u8?a=1758646801%2CM2I5NWIwYjgzMGE0YmRmMTUwYWNlNjg2MWNiMDc4NTgzMmUzMWZlZDc4NzNlNjIxNTEyYjEwM2ZkODA4NmExYg%3D%3D&v=1&f=sd', 'dash_url': 'https://v.redd.it/ytddwvhgkzkf1/DASHPlaylist.mpd?a=1758646801%2CYTkwMWVlYjE1Yzk1ZGZhNWNkNTBkYTMxNmY3Mzk0ZjU1MWU1MmI2ZjBhZWVmZmU1NGJlODdlZWViMjFjZjk0ZQ%3D%3D&v=1&f=sd', 'duration': 43, 'has_audio': True, 'bitrate_kbps': 5000, 'fallback_url': 'https://v.redd.it/ytddwvhgkzkf1/DASH_1080.mp4?source=fallback', 'scrubber_media_url': 'https://v.redd.it/ytddwvhgkzkf1/DASH_96.mp4', 'transcoding_status': 'completed'}}",0,[BF6] The Standard M433 AR,TheBrownSlaya,False,False,False,"{'images': [{'id': 'bDd3cGl3aGdremtmMclG3mCBa5L8gDY_TOG_GtPYZQxwwy7KllXYRadATwPG', 'source': {'url': 'https://external-preview.redd.it/bDd3cGl3aGdremtmMclG3mCBa5L8gDY_TOG_GtPYZQxwwy7KllXYRadATwPG.png?format=pjpg&auto=webp&s=9a55b7eecf35b0ced722a3a36872a1ce3088ff9c', 'width': 3840, 'height': 2160}, 'variants': {}, 'resolutions': [{'url': 'https://external-preview.redd.it/bDd3cGl3aGdremtmMclG3mCBa5L8gDY_TOG_GtPYZQxwwy7KllXYRadATwPG.png?width=108&crop=smart&format=pjpg&auto=webp&s=e9ce02523a41a75da8572442e45eac5f0e7ddfd4', 'width': 108, 'height': 60}, {'url': 'https://external-preview.redd.it/bDd3cGl3aGdremtmMclG3mCBa5L8gDY_TOG_GtPYZQxwwy7KllXYRadATwPG.png?width=216&crop=smart&format=pjpg&auto=webp&s=367b8d354f2583a1e00b22ff5cfb79d4e8913212', 'width': 216, 'height': 121}, {'url': 'https://external-preview.redd.it/bDd3cGl3aGdremtmMclG3mCBa5L8gDY_TOG_GtPYZQxwwy7KllXYRadATwPG.png?width=320&crop=smart&format=pjpg&auto=webp&s=d993e5c81d9931fb129a3904efe2139eebaaa10b', 'width': 320, 'height': 180}, {'url': 'https://external-preview.redd.it/bDd3cGl3aGdremtmMclG3mCBa5L8gDY_TOG_GtPYZQxwwy7KllXYRadATwPG.png?width=640&crop=smart&format=pjpg&auto=webp&s=7ae3512ff26c0d172ea0307c161a05f913d085d4', 'width': 640, 'height': 360}, {'url': 'https://external-preview.redd.it/bDd3cGl3aGdremtmMclG3mCBa5L8gDY_TOG_GtPYZQxwwy7KllXYRadATwPG.png?width=960&crop=smart&format=pjpg&auto=webp&s=b0d31ab76ca7fab5c152894a1aecb39b51be1142', 'width': 960, 'height': 540}, {'url': 'https://external-preview.redd.it/bDd3cGl3aGdremtmMclG3mCBa5L8gDY_TOG_GtPYZQxwwy7KllXYRadATwPG.png?width=1080&crop=smart&format=pjpg&auto=webp&s=8bc9831b46a9ab27b18f78dd4c55a12a04d3e28d', 'width': 1080, 'height': 607}]}], 'enabled': False}",False,,False,/r/Battlefield/comments/1myyquj/bf6_the_standard_m433_ar/,Battlefield,1756049681.0,1,0.5,Battlefield 6
1myyqj7,https://i.redd.it/8s9cmgy7lzkf1.jpeg,,1,Opiniões sobre por onde começar o upgrade no meu PC,ask_luc4as,False,False,False,"{'images': [{'id': 'QAAOA9RUSRPjb0Vlg7oBNFQMYnbhe_FbU8hH7PypgUU', 'source': {'url': 'https://preview.redd.it/8s9cmgy7lzkf1.jpeg?auto=webp&s=1d7914425e3e8ec4e4fa517c618abe91b824e786', 'width': 3000, 'height': 4000}, 'variants': {}, 'resolutions': [{'url': 'https://preview.redd.it/8s9cmgy7lzkf1.jpeg?width=108&crop=smart&auto=webp&s=130267a3f18c50db79210e9bd27e3f8ac15fb952', 'width': 108, 'height': 144}, {'url': 'https://preview.redd.it/8s9cmgy7lzkf1.jpeg?width=216&crop=smart&auto=webp&s=9bc642d996e64f96385c7830f88e97137e8e7258', 'width': 216, 'height': 288}, {'url': 'https://preview.redd.it/8s9cmgy7lzkf1.jpeg?width=320&crop=smart&auto=webp&s=00e2d796c5abbc86731865d91ea10ca5d9088183', 'width': 320, 'height': 426}, {'url': 'https://preview.redd.it/8s9cmgy7lzkf1.jpeg?width=640&crop=smart&auto=webp&s=06e7099a0c72ef49e3dd2b876e21e22e8c2348c7', 'width': 640, 'height': 853}, {'url': 'https://preview.redd.it/8s9cmgy7lzkf1.jpeg?width=960&crop=smart&auto=webp&s=965ce4a2a9afdc45eac4d3a7362936fa761538fb', 'width': 960, 'height': 1280}, {'url': 'https://preview.redd.it/8s9cmgy7lzkf1.jpeg?width=1080&crop=smart&auto=webp&s=f4ce25d3e1089f5f87b48086f97a0adfc336bd3c', 'width': 1080, 'height': 1440}]}], 'enabled': True}",False,"Fala galera, tenho um PC com essas especificações:

Processador: Ryzen 5 2600
Placa de Vídeo: GTX 1660 6GB
Memoria RAM: 16GB
Armazenamento: 240GB SSD M2 + 1TB HD
Placa Mãe: Asus prime b450 
Fonte: Thermaltake 500w

Quero fazer um upgrade aos poucos nesse PC, mas estou na dúvida por onde começar, a principio o que me incomoda mais é acho que vou ter que fazer primeiro é trocar o gabinete,  mas fora isso por onde acreditam que vale mais a pena começar?

Minha motivação é rodar o BF6 e jogos do gamepass decentemente.",False,/r/hardwarebrasil/comments/1myyqj7/opiniões_sobre_por_onde_começar_o_upgrade_no_meu/,hardwarebrasil,1756049661.0,1,1.0,Recomendação
1myyjz2,https://www.reddit.com/r/Battlefield6/comments/1myyjz2/vehicle_destroyed_but_no_kill/,,0,Vehicle destroyed but no kill,Maleficent_Tip384,False,True,False,,False,There were so many times when I destroyed a vehicle but didn’t get a kill. Simply because the people in the vehicle exited sub seconds before my last shot. I don’t know the exact numbers about this or how it was in previous battlefields but this was happening more in bf6. The fix to this might be a slight delay for exiting vehicles or vehicle explosion splash damage. That’s up to you. But it needs to be fixed.,False,/r/Battlefield6/comments/1myyjz2/vehicle_destroyed_but_no_kill/,Battlefield6,1756049238.0,6,0.33,Discussion
1myyjkm,https://www.reddit.com/r/Battlefield6/comments/1myyjkm/if_i_bought_bf6_on_ps5_and_play_bf2024_on_pc_can/,,1,"If i bought bf6 on ps5 and play bf2024 on pc, can the unlocks/skins be moved to ps5 when bf6 comes out? does anyone know if that works? thx",pancakeisi,False,True,False,,False,"Question in title,. just wanna know if i need tk have an ea account or something. is it possible for bf6 skins unlocked via bf2024 on pc can move to bf6 on ps5 when its released",False,/r/Battlefield6/comments/1myyjkm/if_i_bought_bf6_on_ps5_and_play_bf2024_on_pc_can/,Battlefield6,1756049212.0,2,0.6,Question
1myyj7z,https://youtu.be/Z6d_TN0acTM,"{'type': 'youtube.com', 'oembed': {'html': '<iframe width=""356"" height=""200"" src=""https://www.youtube.com/embed/Z6d_TN0acTM?feature=oembed&enablejsapi=1"" frameborder=""0"" allow=""accelerometer; autoplay; clipboard-write; encrypted-media; gyroscope; picture-in-picture; web-share"" referrerpolicy=""strict-origin-when-cross-origin"" allowfullscreen title=""Battlefield 2 MEC Theme - High Definition""></iframe>', 'type': 'video', 'title': 'Battlefield 2 MEC Theme - High Definition', 'width': 356, 'height': 200, 'version': '1.0', 'author_url': 'https://www.youtube.com/@SgtPepper271294', 'author_name': 'Peppermantwist', 'provider_url': 'https://www.youtube.com/', 'provider_name': 'YouTube', 'thumbnail_url': 'https://i.ytimg.com/vi/Z6d_TN0acTM/hqdefault.jpg', 'thumbnail_width': 480, 'thumbnail_height': 360}}",6,Hearing this song playing in the radio in BF6 brought tears into my eyes,Kyeithel,False,False,False,"{'images': [{'id': 'BNTEfZ7dI5ybG48at9Zn1sX2HDxI8WS1o4QRw5zuxiI', 'source': {'url': 'https://external-preview.redd.it/BNTEfZ7dI5ybG48at9Zn1sX2HDxI8WS1o4QRw5zuxiI.jpeg?auto=webp&s=36441bdc12b6761f1e5fedce8ce074149961d293', 'width': 480, 'height': 360}, 'variants': {}, 'resolutions': [{'url': 'https://external-preview.redd.it/BNTEfZ7dI5ybG48at9Zn1sX2HDxI8WS1o4QRw5zuxiI.jpeg?width=108&crop=smart&auto=webp&s=bfa5d093cf832bd362dad307a74f2f4209890353', 'width': 108, 'height': 81}, {'url': 'https://external-preview.redd.it/BNTEfZ7dI5ybG48at9Zn1sX2HDxI8WS1o4QRw5zuxiI.jpeg?width=216&crop=smart&auto=webp&s=8fba74f76d100d89cd5449f08b2b2db2eee6692f', 'width': 216, 'height': 162}, {'url': 'https://external-preview.redd.it/BNTEfZ7dI5ybG48at9Zn1sX2HDxI8WS1o4QRw5zuxiI.jpeg?width=320&crop=smart&auto=webp&s=0a14a8dbc602a73c498c3ddb06a784ef25466b30', 'width': 320, 'height': 240}]}], 'enabled': False}",False,,False,/r/Battlefield/comments/1myyj7z/hearing_this_song_playing_in_the_radio_in_bf6/,Battlefield,1756049188.0,1,1.0,Battlefield 6
1myyfrh,https://www.reddit.com/r/battlefield2042/comments/1myyfrh/battlefield_games_on_different_platforms_will_i/,,1,Battlefield games on different platforms - will I get rewards?,jacko0o,False,True,False,,False,I purchased BF2042 directly from the EA client. I farm my Battlepass there. I pre-ordered BF6 on Steam. Will I get the rewards unlocked in the Battlepass in the EA client on Steam? My Steam account is linked to my EA account.,False,/r/battlefield2042/comments/1myyfrh/battlefield_games_on_different_platforms_will_i/,battlefield2042,1756048967.0,2,1.0,Question
1myy3t4,https://www.reddit.com/r/Battlefield/comments/1myy3t4/proners/,,0,Proners,Eric_Antomas,False,True,False,,False,Anyone notice the surge in crawling campers and prone pushers/corner holding while prone since BF6 beta or have I never noticed this in previous games ,False,/r/Battlefield/comments/1myy3t4/proners/,Battlefield,1756048215.0,5,0.4,Battlefield 2042
1myxuaw,https://youtu.be/-5pyLavnlsY?si=-5HoOPE4VILI0pDg,"{'type': 'youtube.com', 'oembed': {'html': '<iframe width=""356"" height=""200"" src=""https://www.youtube.com/embed/-5pyLavnlsY?feature=oembed&enablejsapi=1"" frameborder=""0"" allow=""accelerometer; autoplay; clipboard-write; encrypted-media; gyroscope; picture-in-picture; web-share"" referrerpolicy=""strict-origin-when-cross-origin"" allowfullscreen title=""This is CRAZY! 9800X3D vs 14900K vs 285K BF6 CPU Test – The Truth!""></iframe>', 'type': 'video', 'title': 'This is CRAZY! 9800X3D vs 14900K vs 285K BF6 CPU Test – The Truth!', 'width': 356, 'height': 200, 'version': '1.0', 'author_url': 'https://www.youtube.com/@DannyzReviews', 'author_name': 'DannyzReviews', 'provider_url': 'https://www.youtube.com/', 'provider_name': 'YouTube', 'thumbnail_url': 'https://i.ytimg.com/vi/-5pyLavnlsY/hqdefault.jpg', 'thumbnail_width': 480, 'thumbnail_height': 360}}",0,This is CRAZY! 9800X3D vs 14900K vs 285K BF6 CPU Test – The Truth!,Distinct-Race-2471,False,False,False,"{'images': [{'id': 'QkryPJ2OINtnAYHpyhYuJ1jNKOflI_QJAFrkiyEQa1g', 'source': {'url': 'https://external-preview.redd.it/QkryPJ2OINtnAYHpyhYuJ1jNKOflI_QJAFrkiyEQa1g.jpeg?auto=webp&s=854ab7bb160f9aaed0ba5c10a4b38b0fcfd536e5', 'width': 480, 'height': 360}, 'variants': {}, 'resolutions': [{'url': 'https://external-preview.redd.it/QkryPJ2OINtnAYHpyhYuJ1jNKOflI_QJAFrkiyEQa1g.jpeg?width=108&crop=smart&auto=webp&s=152e3c83f783047415a51bd4d00bc22bbbec7385', 'width': 108, 'height': 81}, {'url': 'https://external-preview.redd.it/QkryPJ2OINtnAYHpyhYuJ1jNKOflI_QJAFrkiyEQa1g.jpeg?width=216&crop=smart&auto=webp&s=12640f2d83cda7c8335128711c111e019f3e98d5', 'width': 216, 'height': 162}, {'url': 'https://external-preview.redd.it/QkryPJ2OINtnAYHpyhYuJ1jNKOflI_QJAFrkiyEQa1g.jpeg?width=320&crop=smart&auto=webp&s=8270cc8eb84f60d867bfde5e1c9c93bd1f2aea36', 'width': 320, 'height': 240}]}], 'enabled': False}",False,"Top reviewer disproves HWU. Intel reigns supreme for 1% lows! Comments say HWU results ""suspicious"".  Oh no!!!",False,/r/TechHardware/comments/1myxuaw/this_is_crazy_9800x3d_vs_14900k_vs_285k_bf6_cpu/,TechHardware,1756047622.0,0,0.29,🚨 Urgent News 🚨
1myxmmw,https://www.reddit.com/r/hardwarebrasil/comments/1myxmmw/rx_6600_vs_arc_b580/,,1,RX 6600 vs Arc B580,marinov1c,False,True,False,,False,"

Estou querendo trocar minha gpu pra jogar o BF6 e outros games nesse nível, e futuramente num qhd.

Meu setup é: 
Processador: Intel Core i5-12400

Placa-mãe: Gigabyte H610M H DDR4

Placa de vídeo: AMD Radeon RX 6600

Memória RAM: 16 GB DDR4

Valeria a pena a troca ou manter a 6600 e pegar uma melhor futuramente? 

Penso numa vram mais alta também, porém as de 16gb andam com preços muito elevados",False,/r/hardwarebrasil/comments/1myxmmw/rx_6600_vs_arc_b580/,hardwarebrasil,1756047111.0,1,1.0,Dúvida
1myxe8x,https://www.reddit.com/r/nvidia/comments/1myxe8x/upgrade_from_3090ti/,,0,Upgrade from 3090ti,Painkiller8900,False,True,False,,False,Is it worth upgrading from 3090ti to 5080? If yes which brand of card should I get. Currently i am using it for 1440p 360hz. Games like bf6 and warzone. Please advise. I have amd 5900x.,False,/r/nvidia/comments/1myxe8x/upgrade_from_3090ti/,nvidia,1756046581.0,6,0.5,Question
1myxe8b,https://www.reddit.com/r/Battlefield/comments/1myxe8b/i_want_to_continue_playing_with_this_guy_in_bf6/,,0,I want to continue playing with this guy in bf6!,Ok_Slide8677,False,True,False,,False,"https://preview.redd.it/2khttdlrbzkf1.jpg?width=1072&format=pjpg&auto=webp&s=ce5617631f121b392fd573f2b0ed947474047649

https://preview.redd.it/6dcwzeuybzkf1.jpg?width=1920&format=pjpg&auto=webp&s=e1ed253733db3c659325cce1c8376533d621ea00

We need this trio in bf6, you know the other two, this weapon and that shield! u/battlefield  
  
",False,/r/Battlefield/comments/1myxe8b/i_want_to_continue_playing_with_this_guy_in_bf6/,Battlefield,1756046579.0,4,0.25,Battlefield 6
1myx9nf,https://www.reddit.com/r/Battlefield/comments/1myx9nf/are_the_people_saying_bf6_looks_better_without/,,0,Are the people saying BF6 looks better without “the filter” the same that say 2042 looks good?,mistakesmostly,False,True,False,,False,"Genuine question, no judgment really.

I fall on the side of preferring the “filter” (I think that’s a dumb way of boiling it down but helpful shorthand), but I’ve also been seeing people praising 2042’s visuals recently and to me the no filter images have a similar “clarity over art direction” style that imo left 2042 feeling very sterile and thus hard to commend visually",False,/r/Battlefield/comments/1myx9nf/are_the_people_saying_bf6_looks_better_without/,Battlefield,1756046275.0,13,0.29,Discussion
1myx3ip,https://www.reddit.com/r/battlefield3/comments/1myx3ip/bf3_missed_connection_imag_clan/,,1,BF3 Missed Connection - iMag clan,MrStealYourScoops,False,True,False,,False,"This is a long shot, but did anyone here have or know anyone with the [iMag] clan tag? There were a few of you, including a guy named “Ajar”, who my cousin and I used to play with (against) a ton back in the BF3 glory days. Lots of squad death match, lots of Bazaar. Funny enough, we still talk about our rivalries with these players to this day. It would be cool to reconnect with the eve of BF6 upon us. 

To be clear, we never spoke, never “met”… yet we were always against each other ",False,/r/battlefield3/comments/1myx3ip/bf3_missed_connection_imag_clan/,battlefield3,1756045864.0,0,1.0,
1myx23q,https://www.reddit.com/r/Battlefield/comments/1myx23q/recon_should_be_reconfigured_to_use_dmrs_as_their/,,0,"Recon should be reconfigured to use DMRs as their default weapon, not snipers",Kothre,1756046567.0,True,False,,False,"The way snipers have been implemented in *Battlefield* has been broken for years. BF6 is the perfect opportunity to fix it.

For basically every iteration of the series, Recon has meant camping on a hill or rooftop and not playing the objective. A quarter of the classes is essentially dedicated to playing their own minigame instead of being in the same fight as everyone else. The game would be much healthier if every class were part of the front line instead only three of them.

Here’s why I think Recon should be reconfigured around **DMRs as their default class weapon** instead of snipers:

* **Sniper spam is toxic and unfun.** Entire hillsides of glinting players add nothing to objective play. It’s frustrating to play against and frustrating to rely on them as teammates. Snipers are effectively playing their own minigame instead of actually being in the same sphere as the rest of the players.
* **Even DICE knows sniper spam is a problem.** That’s why they've taken this heavy-handed approach to nerfing snipers with hyperbolic scope glint for multiple *Battlefield* entries now. It’s not only unrealistic but also makes playing as a sniper annoying, but it’s the only way they can “balance” sniper spam without rethinking the class structure. 
* **DMRs make more sense vis-a-vis real-life squad formation.** In real squad tactics, designated marksmen are integrated into infantry squads—covering the 300–600m fight with precision fire. Bolt-action snipers are rare specialist teams employed to take out high-value targets.. Switching Recon to DMRs would give them a **distinct role** (precision mid-range support) that complements Assault and doesn't render 1/4 of the available classes to being useless (at least with their default weapon class) on smaller maps.
* **True snipers should be limited assets.** In real life, they’re not every squad—they’re specialist 2-man teams used to pick off high-value targets. In-game, they’d work better if they were rare and limited, just like vehicles. Imagine a handful of sniper slots per team instead of entire squads wasting slots in the hills.
* **Recon class equipment already benefits being closer to the front lines.** The T-UGS, proximity sensors, the new UAV scan in BF6 actually wants to push Recon to being on the frontlines. *Battlefield 6* is the perfect opportunity to finally make Recon a normal class instead of a meme. Now they'll have much more incentive to actually use that utility to help their team instead of camping in the back.
* **By limiting snipers, we can close the in-game performance gap between snipers and DMRs.** As it stands, dedicated sniper rifles are in this weird spot where they only one-shot on a headshot, which renders them kind of useless at mid-range when you can just use a DMR instead. If both are two-shots, why use a bolt-action outside of maximal range? With limited snipers, we can also undo the heavy-handed nerf of scope glint, as well, and turn snipers into the stealthy, HVT-killing specialists they are in real life. Snipers would also be more fun to play knowing you don't light up like a Christmas tree every time you aim. Incidentally, these changes would actually make sniping more rewarding and fun since it won’t be burdened by stopgap measures to nerf them.

Battlefield has been trying to paper over the sniper issue for multiple titles now, but BF6 could actually solve it by rethinking Recon entirely. Give them DMRs as their bread and butter. Make bolt-action sniper rifles a limited team resource like vehicle spawns. It would be truer to real tactics, better for balance, and way less miserable to play against. Please make it happen. I know I’m fighting decades of tradition by suggesting this, but I think it would breathe new life into the series.

What do you all think?",False,/r/Battlefield/comments/1myx23q/recon_should_be_reconfigured_to_use_dmrs_as_their/,Battlefield,1756045765.0,12,0.5,Battlefield 6
1mywsir,https://www.reddit.com/r/PcBuild/comments/1mywsir/do_i_bother_with_upgrading_my_pc_or_do_i_buy_an/,,1,Do I bother with upgrading my pc or do I buy an all new one?,Ispep_evol,False,True,False,,False,"Been toying with the idea of upgrading my pc, I want something that can comfortably run new AAA games for example bf6 when it comes out at high+ settings

My current specs are:

CPU- AMD ryzen 5 5600G w Radeon Graphics, 3601 Mhz, 6 cores, 12 logical processors

Board- TUF GAMING X570-PLUS (wi-fi)

Gpu- GeForce RTX 2060 6gb

Memory- VENGEANCE RGB PRO 16gb (2x8gb) DDR4 DRAM 3200MHz C16 Memory

Storage- samsung ssd 970 evo plus 1tb

Psu- Corsair cv450.

If I were to buy new my budget would be around £1500-1750, what could I get for that?",False,/r/PcBuild/comments/1mywsir/do_i_bother_with_upgrading_my_pc_or_do_i_buy_an/,PcBuild,1756045106.0,4,1.0,Question
