id,url,media,score,title,author,edited,is_self,over_18,preview,spoiler,selftext,stickied,permalink,subreddit,created_utc,num_comments,upvote_ratio,link_flair_text
1myc66x,https://www.reddit.com/r/Battlefield/comments/1myc66x/does_anyone_know/,,4,Does anyone know?,SandwichPlastic5100,False,True,False,,False,"Will BF6 be going to EA PLAY from launch? I haven't seen anything on the topic, just know they sometimes bring games to EA play from day 1 not too sure on this though as it will be a HUGH seller.",False,/r/Battlefield/comments/1myc66x/does_anyone_know/,Battlefield,1755981028.0,2,1.0,Battlefield 6
1myc5le,https://www.reddit.com/r/Battlefield/comments/1myc5le/dear_eadice/,,2,Dear EA/Dice,TheLazyRedditer,False,True,False,,False,How am I supposed to level up the free battle pass for BF6 rewards when I black screen every 2-3 matches?,False,/r/Battlefield/comments/1myc5le/dear_eadice/,Battlefield,1755980988.0,1,1.0,Battlefield 2042
1myc4y7,https://www.reddit.com/gallery/1myc4y7,,0,Can’t update my BIOS,Impressive_Junket_52,False,False,False,,False,"4 years ago I bought a prebuilt with some deployment money I saved up, I bought the prebuilt because at the time it was more cost effective to just buy exactly what I wanted already built as scalpers were selling the GPU I wanted for way too much. Fast forward to now, I wanted to play BF6 but it requires secure boot to be enabled. Enabling it on my PC causes windows to not boot and I sit at a black screen. Read some forums that claimed reseating the CMOS worked for them so I tried it, no dice. My search lead me to trying to update my BIOS which is still on the first version of when I originally bought the PC. I have a Z490-A PRO (MS-7C75). When I try and update the firmware it tells me that the BIOS version I’m trying to update it to is an older version and won’t let me update but the board clearly recognizes that the update is newer, as the build date shows it’s from 2021 which my current BIOS version is from 2020. I just want to play Battlefield games, man. This whole process has been an absolute nightmare. (That update is the only one I can find for my specific motherboard.) Anyone that has this model, how did you fix this problem?",False,/r/MSI_Gaming/comments/1myc4y7/cant_update_my_bios/,MSI_Gaming,1755980947.0,9,0.4,Troubleshooting
1myc0xr,https://www.reddit.com/r/battlefield2042/comments/1myc0xr/2042_recent_surge/,,1,2042 recent surge,SatisfactionLimp5304,False,True,False,,False,"After this post-BF6 Beta surge in players to 2042. What have you noticed in lobbies more often than before?

Personally, it seems like the entire lobby is now using the TGM’s. I’m not mad, I just think it’s sort of funny. Every time I’m in armor or a heli, it’s a non-stop bombardment of TGM’s. Seems like the new players sure do love them.",False,/r/battlefield2042/comments/1myc0xr/2042_recent_surge/,battlefield2042,1755980672.0,4,1.0,Discussion
1mybwrr,https://www.reddit.com/r/Battlefield/comments/1mybwrr/2042_maps_in_bf6/,,1,2042 Maps in BF6?,Hadrosaur_Hero,False,True,False,,False,"While we wait for BF6, I ask the community are there any maps in 2042 that have the foundations worth adding into BF6? Revamped somewhat to redraw map borders, only a specific version like a Breakthrough version of a map, or brought in as it is. Are there any maps in 2042 worth bringing over to BF6 or are they best left to past forever?",False,/r/Battlefield/comments/1mybwrr/2042_maps_in_bf6/,Battlefield,1755980393.0,6,1.0,Discussion
1mybvxe,https://www.reddit.com/r/Battlefield/comments/1mybvxe/is_it_weird_that_i_like_bf2042_over_bf6/,,0,Is it weird that I like BF2042 over BF6?,SociallyConstipated,1755984079.0,True,False,,False,"I like the movement, aiming, killcam, even the menu UI better. The storm stuff was cool at first but I lost interest very quickly. I'm curious what are some things you like better in BF6?",False,/r/Battlefield/comments/1mybvxe/is_it_weird_that_i_like_bf2042_over_bf6/,Battlefield,1755980334.0,5,0.4,Battlefield 6
1mybt6q,https://www.reddit.com/r/CollegeUltimateTeam/comments/1mybt6q/i_think_im_done/,,3,i think i’m done,Hour_Pop_4899,False,True,False,,False,"honestly, i’m just tired of the temptation of spending money on packs that are rewarding 25% of the time. same with mut. i think ima just call it quits for ultimate team. minimal rewards, constant market checking, constant pack chasing, the whole UT mode just feels ran through for me. ima find new games to play, maybe bf6 or whatever but i cant with ultimate team anymore ",False,/r/CollegeUltimateTeam/comments/1mybt6q/i_think_im_done/,CollegeUltimateTeam,1755980151.0,22,0.67,🤬venting/complaints🤬
1mybs22,https://www.reddit.com/r/Battlefield/comments/1mybs22/guys_is_it_just_me_or_do_character_models_go/,,0,"Guys, is it just me, or do character models go almost black past ~10 m?",MDPROBIFE,False,True,False,,False,"This is the thing I hate most about Battlefield. I played a lot of BF4 and it was my main complaint then. After the BF6 beta it’s still there, and I rarely see it discussed.

In a fast-paced shooter I spot a player but have to check for the dorito to know if they’re enemy or friendly. It kills immersion.

It’s also why hardcore without doritos doesn’t work: everyone collapses into a dark silhouette.

  
Is nobody else bothered by this?",False,/r/Battlefield/comments/1mybs22/guys_is_it_just_me_or_do_character_models_go/,Battlefield,1755980075.0,1,0.5,Discussion
1mybnc6,https://www.reddit.com/r/Battlefield/comments/1mybnc6/bf6_feeling/,,1,BF6 feeling,PutsonPutin,False,True,False,,False,"Did anyone else have the feeling that the game menu and gameplay (like using a key for several actions) was programmed for consoles instead of a computer?

I kinda got the feeling I get from PlayStation games while playing the beta…",False,/r/Battlefield/comments/1mybnc6/bf6_feeling/,Battlefield,1755979759.0,2,0.67,Battlefield 6
1myb60i,https://www.reddit.com/r/PcBuild/comments/1myb60i/any_tips_for_this_build_or_any_issues_with_the/,,1,Any tips for this build or any issues with the current parts?,Tedoari,False,True,False,,False,"Hey there, I am looking to build my first PC, budget around 1500 euros but would be nice if its slightly lower (Already made the price from the current list lower by 155 euros so actual price is 1372).  
I mainly play EFT, Warzone, DayZ (At low graphics or lag spikes frame wise) and wanting to play Ready or Not and BF6 when it comes out.

  
I am wondering if that are any tips on what could be better and if its good enough to run those games. I'm also wondering if anyone sees any issues compatibility wise wit the parts so far. I know pcpartpicker has a feature for this but i don't know how reliable it is (It does say compatible)

PcPartPicker: [https://nl.pcpartpicker.com/list/vBB7Nz](https://nl.pcpartpicker.com/list/vBB7Nz)  
",False,/r/PcBuild/comments/1myb60i/any_tips_for_this_build_or_any_issues_with_the/,PcBuild,1755978620.0,3,1.0,Build - Help
1myay2b,https://www.reddit.com/gallery/1myay2b,,398,"EA we don't want ""Playlists"", we want this!",Fatal_Explorer,False,False,False,,True,"Ea It's so easy, Just give us back what we already had and you took from us. 
We don't want Playlists, matchmaking or beeing treated as toddlers. Please bring back this style of browser for PC, we don't want console style lobbys. We want to play with our friends, join the same game, side of the game and also have squads together. 
Votemap, do you remember that? Such an easy but great basic feature? Setting up our own servers and having them ranked? Yes? 


After playing the beta of BF6 I went back to BF3 and BF4, boy that hit right in the feels. We had it so good on PC with BF3 in particular.",False,/r/Battlefield6/comments/1myay2b/ea_we_dont_want_playlists_we_want_this/,Battlefield6,1755978105.0,132,0.84,Discussion
1myauic,https://i.redd.it/3487368rntkf1.png,,2022,Do you think Squad Reinforcements should come back to bf6?,PuzzleheadedPut2876,False,False,False,"{'images': [{'id': 'QmmkwSKYMtys-nmPdBWwmXJDOD2LCU6J8Ghcg5YUuAo', 'source': {'url': 'https://preview.redd.it/3487368rntkf1.png?auto=webp&s=f955609df90e497706b6b0f5ad331ae90e82f542', 'width': 720, 'height': 456}, 'variants': {}, 'resolutions': [{'url': 'https://preview.redd.it/3487368rntkf1.png?width=108&crop=smart&auto=webp&s=385a52239ed69394975b84420248dc47981a300a', 'width': 108, 'height': 68}, {'url': 'https://preview.redd.it/3487368rntkf1.png?width=216&crop=smart&auto=webp&s=9d5e88581b2dd70c2aa87690c27d5ab5ff3cbe83', 'width': 216, 'height': 136}, {'url': 'https://preview.redd.it/3487368rntkf1.png?width=320&crop=smart&auto=webp&s=f42b7a56fad5ab31b6d59ceec2c7fabb40d3a9bb', 'width': 320, 'height': 202}, {'url': 'https://preview.redd.it/3487368rntkf1.png?width=640&crop=smart&auto=webp&s=6655aa28bee1e556f34665741ad9d71d77b5bf03', 'width': 640, 'height': 405}]}], 'enabled': True}",False,I think stealth bomber replace jb2 and crusie missile replace cluster strike and so on. I also feel like they should lean heavily towards object points to get these so people don't kill farm for them,False,/r/Battlefield6/comments/1myauic/do_you_think_squad_reinforcements_should_come/,Battlefield6,1755977870.0,222,0.93,Discussion
1myatj2,https://www.reddit.com/r/Battlefield/comments/1myatj2/trying_some_2042_baffling_that_post_launch/,,0,"Trying some 2042, baffling that post launch vehicle there are so much better than BF6",Forsaken-Put1701,False,True,False,,False,"Have they learned anything from 2042 feedback? i would like to think they did cause coming back to the game the vehicle gameplay is a farcry in a positive way from launch.

Air vehicles are effective and fun despite feeling a bit odd. they fly much tighter compared to whatever the hell we got at launch and tank gameplay is actually solid! they got rid of the slow ass through the mud aiming since BF1 and you can actually have some fun playing aggro.

i wouldn't cry about balance yet but if the balance we gonna get is like the beta its gonna be pain. you are either a god or die in a second. 

im just shocked how we are back to square 1 in regard to vehicles. why not using any of these improvements, make them even better for BF6? what the fuck happened?",False,/r/Battlefield/comments/1myatj2/trying_some_2042_baffling_that_post_launch/,Battlefield,1755977807.0,9,0.4,Battlefield 6
1myaopb,https://www.reddit.com/r/Battlefield/comments/1myaopb/bf6_console_button_mapping/,,5,BF6 Console button mapping,Different-Carry5504,False,True,False,,False,"As a BF/FPS veteran, I’ve always liked having my crouch button to be R3 (Xbox btw) instead of it being my melee, for obvious reasons. After remapping my melee to B, my character would continue crouching while knifing and it was driving me up a wall during the first and second week of the beta. I then tried the alternate button controls and yet it would still continue to happen. Has anybody else had this problem? If so, how did you fix it? When the game officially launches I’d like to have all my controls fleshed out and not have to worry about having wonky controls.

Side note: BF devs swapping the spot and grenade buttons on controller was a very goofy decision on their part and I’m hoping they switch it back upon release. It’s very easily alleviated by mapping the buttons back to the way it used to be, but the fact they changed it in the first place was definitely a mistake on their end ",False,/r/Battlefield/comments/1myaopb/bf6_console_button_mapping/,Battlefield,1755977482.0,4,1.0,Question
1myamz1,https://www.reddit.com/r/Battlefield/comments/1myamz1/bf6_gameplay_exhaustion_complaints_youre_playing/,,2,"BF6 gameplay ""exhaustion"" complaints, you're playing wrong",cozzzy96,False,True,False,,False,"Saw a bunch of posts claiming the gameplay is too hectic, that there's no time to breathe. Stop playing it like call of duty. You don't need to constantly storm the hottest objective on the frontline. Flank, let your squad spawn on you, hold an angle, revive your teammates, etc. You're meant to be a nameless soldier, not John Wick. Embrace the glory of the chaos and find your place within it.",False,/r/Battlefield/comments/1myamz1/bf6_gameplay_exhaustion_complaints_youre_playing/,Battlefield,1755977360.0,18,0.53,Battlefield 6
1myamog,https://v.redd.it/ab0vbfj6mtkf1,"{'reddit_video': {'width': 720, 'height': 1280, 'is_gif': False, 'hls_url': 'https://v.redd.it/ab0vbfj6mtkf1/HLSPlaylist.m3u8?a=1758646885%2CZjYwZjhmMzQ4YzZkYTIwYTIyNGM0ZWVkZmU3ZDM3MDg4YmIyOGZmNGZkNmQwNWNmNTE0OGNlOTU3NDM0ZmVjNw%3D%3D&v=1&f=sd', 'dash_url': 'https://v.redd.it/ab0vbfj6mtkf1/DASHPlaylist.mpd?a=1758646885%2CMzVjNzg4NDkyMTIwMThhZWFiMzNhMDkyYThmMjMyYWE5N2NkNTA4NjdhYzBjZDkwNTYxMjRjYjIzMzc0ZWQ4Zg%3D%3D&v=1&f=sd', 'duration': 7, 'has_audio': True, 'bitrate_kbps': 2400, 'fallback_url': 'https://v.redd.it/ab0vbfj6mtkf1/DASH_720.mp4?source=fallback', 'scrubber_media_url': 'https://v.redd.it/ab0vbfj6mtkf1/DASH_96.mp4', 'transcoding_status': 'completed'}}",0,Holy moly!!!,FOBst3r,False,False,False,"{'images': [{'id': 'cmdxZTViZzZtdGtmMRstlkSCxmsVwxPnq1yOUB_CE8xtohamMwfNwA1QwuS8', 'source': {'url': 'https://external-preview.redd.it/cmdxZTViZzZtdGtmMRstlkSCxmsVwxPnq1yOUB_CE8xtohamMwfNwA1QwuS8.png?format=pjpg&auto=webp&s=db92aaa60843f7dd5971ac86d545c6da8532c21a', 'width': 720, 'height': 1280}, 'variants': {}, 'resolutions': [{'url': 'https://external-preview.redd.it/cmdxZTViZzZtdGtmMRstlkSCxmsVwxPnq1yOUB_CE8xtohamMwfNwA1QwuS8.png?width=108&crop=smart&format=pjpg&auto=webp&s=966b23a9ca5d6b6db72df00cc6cae0369a6b77a0', 'width': 108, 'height': 192}, {'url': 'https://external-preview.redd.it/cmdxZTViZzZtdGtmMRstlkSCxmsVwxPnq1yOUB_CE8xtohamMwfNwA1QwuS8.png?width=216&crop=smart&format=pjpg&auto=webp&s=ced3e349ad978a01b3cb8339d74d934663483cb3', 'width': 216, 'height': 384}, {'url': 'https://external-preview.redd.it/cmdxZTViZzZtdGtmMRstlkSCxmsVwxPnq1yOUB_CE8xtohamMwfNwA1QwuS8.png?width=320&crop=smart&format=pjpg&auto=webp&s=b1035c308b976b004af8ea74f2f6c63c8ef8ae26', 'width': 320, 'height': 568}, {'url': 'https://external-preview.redd.it/cmdxZTViZzZtdGtmMRstlkSCxmsVwxPnq1yOUB_CE8xtohamMwfNwA1QwuS8.png?width=640&crop=smart&format=pjpg&auto=webp&s=af56b68a85e002665b18361889ec19f3f5a569f2', 'width': 640, 'height': 1137}]}], 'enabled': False}",False,"I went to GS today, their pro week sale ends after today btw. I traded in some old games. 
Ps….
The 20% extra trade in credit AND the 20% extra trade in towards preorder, THEY STACK!!! I ended up getting like and extra $40 
Anyway, this is my haul. Check it out 
I also preordered some pops and Gears of war reloaded (paid in full) and BF6 ($5 down) andddd the new sonic racing game ($5 down) ",False,/r/GameStop/comments/1myamog/holy_moly/,GameStop,1755977342.0,9,0.28,Experiences
1myakrc,https://www.reddit.com/r/ROGAlly/comments/1myakrc/rog_allyrog_ally_x_battlefield_2042_and_6_beta/,,2,Rog Ally/Rog Ally X Battlefield 2042 and 6 beta Lagging,ystolai,False,True,False,,False,"A lot of people are running into this issue in Battlefield 2042 (and also in the BF6 Beta), where the FPS warning icon pops up even when the game is running at 50–60 FPS or higher. The point is, it’s not just the icon showing up — when it appears, the game actually lags: inputs feel delayed and even shots don’t register on the enemy.

In reality, this isn’t exactly an FPS problem but rather **Time Nudge (TN)**, a network metric Battlefield uses to measure synchronization between the client (your PC/handheld) and the server.

This “phantom lag” happens because the **Rog Ally (and similar handhelds)** use a dynamic power management system that shifts power between CPU and GPU depending on the load. In heavy scenes, the CPU gets heavily taxed with graphics and can’t keep up with the constant back-and-forth communication with the server. The result: TN spikes, and the game interprets it as an FPS/network issue, triggering the warning — along with real gameplay lag.

# The solution I found

What pretty much fixed it for me was **creating custom fixed power profiles on the Rog Ally**, both for plugged-in and battery mode:

* **Plugged in**:
   * SPL = 30W
   * SPPT = 30W
   * FPPT = 35W
* **On battery**:
   * SPL = 25W
   * SPPT = 25W
   * FPPT = 25W

With this setup, the problem is almost gone. The warning icon might still show up on very rare occasions, but it lasts less than 2 seconds and doesn’t really affect gameplay anymore.

# About packet loss

I was also experiencing a lot of **packet loss**, which triggered the network warning icon frequently. After checking the specs of the **Rog Ally X**, I noticed it supports **Wi-Fi 6E**, while my router was only Wi-Fi 5.  
Upgrading to a **Wi-Fi 6 router** made a huge difference — now the packet loss warning rarely ever shows up.

# Why this works

1. **Fixed power delivery** → prevents CPU/GPU power swings, keeping Time Nudge stable.
2. **Wi-Fi 6+ routers** → offer better bandwidth, lower latency, and stronger stability for modern handhelds like the Rog Ally X.
   * Wi-Fi 5 can bottleneck these devices, especially in competitive online games.
   * Wi-Fi 6 (and 6E) ensures more consistent communication with game servers, reducing both **lag spikes** and **packet loss**.

👉 In short:  
Stabilize your **power profiles** \+ use at least a **Wi-Fi 6 router** = way smoother online experience on handhelds like the Rog Ally.",False,/r/ROGAlly/comments/1myakrc/rog_allyrog_ally_x_battlefield_2042_and_6_beta/,ROGAlly,1755977209.0,6,0.67,Discussion
1myaj34,https://www.reddit.com/r/CrackSupport/comments/1myaj34/cant_find_a_safe_bf34_mp_crack_anywhere/,,0,Can’t Find a Safe BF3/4 MP Crack Anywhere.,CommunicationStill34,False,True,False,,False,"After playing the BF6, I’ve gotten a bit of an itch for the BF games, so I’ve decided to replay the old ones. I’ve searched r/piracy and r/piratedgames and all the results only include ZLOrigin, which is intact spyware. Online-fix.me also doesn’t carry any. Help me please. Also I really don’t want to buy it, I only got $1 left in my steam wallet. I’m broke.",False,/r/CrackSupport/comments/1myaj34/cant_find_a_safe_bf34_mp_crack_anywhere/,CrackSupport,1755977101.0,1,0.5,
1my9tf4,https://www.reddit.com/r/AdultGamers/comments/1my9tf4/31m_eu_lf_frens_rpg_survival_fps/,,0,"31M (EU) LF frens. (rpg, survival, fps)",Silver_Models,False,True,False,,False,"PC

31M seeking friends to play games with. Survival games such as Minecraft modded, Valheim, sons of the forest, 7 days to die. 
Fps: war thunder, battlefield (incl Bf6), not quite cod. 
Rpg: Baldurs gate... Ain't got anything else xD

Generally open to games. 
I'm running of Paris time, but I'm not ""time locked"". ",False,/r/AdultGamers/comments/1my9tf4/31m_eu_lf_frens_rpg_survival_fps/,AdultGamers,1755975414.0,0,0.5,LFG
1my9pld,https://www.reddit.com/r/Battlefield/comments/1my9pld/ttk_in_bf2042_vs_bf6/,,1,TTK in BF2042 vs BF6,Junny2177,False,True,False,,False,"Didn't play much other BF titles (only BF1), and spent about 30 hours in BF6 after it ended I bought BF2042 on a sale and now exploring it I find that TTK feels significantly lower (i.e I kill faster with assault/carabines) than in BF6. Can someone say is it me or in bf6 ttk is really longer?",False,/r/Battlefield/comments/1my9pld/ttk_in_bf2042_vs_bf6/,Battlefield,1755975160.0,7,0.67,Battlefield 6
1my9jbm,https://i.redd.it/o3kymlxhetkf1.jpeg,,29,The duality of man.,PsychoticPanda_,False,False,False,"{'images': [{'id': 'dvGSM7FeuoltTjCX2zmkA2U6Bksv-psIT6G92IWkk4s', 'source': {'url': 'https://preview.redd.it/o3kymlxhetkf1.jpeg?auto=webp&s=057e9f885a4d3e28a94265e4ba6af7c86a054823', 'width': 720, 'height': 768}, 'variants': {}, 'resolutions': [{'url': 'https://preview.redd.it/o3kymlxhetkf1.jpeg?width=108&crop=smart&auto=webp&s=0f3cb531d651b643adf53ba39d995c23cb08c019', 'width': 108, 'height': 115}, {'url': 'https://preview.redd.it/o3kymlxhetkf1.jpeg?width=216&crop=smart&auto=webp&s=21f76a29f5b7fe0c927a9ac2c993c5b8d10f3c16', 'width': 216, 'height': 230}, {'url': 'https://preview.redd.it/o3kymlxhetkf1.jpeg?width=320&crop=smart&auto=webp&s=95408454cb4abe168be2c61253a80af44075d642', 'width': 320, 'height': 341}, {'url': 'https://preview.redd.it/o3kymlxhetkf1.jpeg?width=640&crop=smart&auto=webp&s=7b078e6a6a3832e5d57257396e9e9bd23333bebb', 'width': 640, 'height': 682}]}], 'enabled': True}",False,This is all I see in these subs anymore... ,False,/r/Battlefield/comments/1my9jbm/the_duality_of_man/,Battlefield,1755974757.0,25,0.81,Battlefield 6
1my9iw1,https://www.reddit.com/r/badcompany2/comments/1my9iw1/offline_mod_for_bots/,,4,Offline mod for bots?,Stryker412,False,True,False,,False,"After playing BF6, I wanted to show my son some of the OG games. BC2 was one of my favorites of the series outside of BF2/1942. Are there mods that still work to allow for offline playing with bots? I did get Project Rome going so we're good for online play, just looking for offline to practice and have him check it all out.",False,/r/badcompany2/comments/1my9iw1/offline_mod_for_bots/,badcompany2,1755974728.0,5,1.0,Question
1my9iok,https://www.reddit.com/r/Battlefield/comments/1my9iok/will_battlefield_6_have_bots/,,0,Will Battlefield 6 have bots?,-INC0GN1TO-,False,True,False,,False,"I'm asking because I'm very curious about buying BF6. I'm looking for a new shooter, but it's been very long since I've played a shooter game. I'm a bit worried of getting ruthlessly obliterated by other players, so I'm asking if there will be bits so I can train and come back into the shooting game genre!",False,/r/Battlefield/comments/1my9iok/will_battlefield_6_have_bots/,Battlefield,1755974716.0,4,0.5,Question
1my9hxe,https://i.redd.it/33s0aqb8etkf1.jpeg,,34,The duality of man.,PsychoticPanda_,False,False,False,"{'images': [{'id': 'WD2pCFK8lyLOlrDXu_mIIIdjZB8MK6dKTnB_jW_YQYs', 'source': {'url': 'https://preview.redd.it/33s0aqb8etkf1.jpeg?auto=webp&s=e856bc40b38cba83e233930d196bc0518fa851b6', 'width': 720, 'height': 768}, 'variants': {}, 'resolutions': [{'url': 'https://preview.redd.it/33s0aqb8etkf1.jpeg?width=108&crop=smart&auto=webp&s=679057fcf612381169ef18da00104e6f8457cf1c', 'width': 108, 'height': 115}, {'url': 'https://preview.redd.it/33s0aqb8etkf1.jpeg?width=216&crop=smart&auto=webp&s=82ec6402e35e7c8569fa5e90ab87569947da06e8', 'width': 216, 'height': 230}, {'url': 'https://preview.redd.it/33s0aqb8etkf1.jpeg?width=320&crop=smart&auto=webp&s=69a63b1b61777a2cbfde422df55e2e69453f6674', 'width': 320, 'height': 341}, {'url': 'https://preview.redd.it/33s0aqb8etkf1.jpeg?width=640&crop=smart&auto=webp&s=208717de26559b7f8123c209d3f2a02ed5028d63', 'width': 640, 'height': 682}]}], 'enabled': True}",False,This is all I see in these subs anymore... ,False,/r/Battlefield6/comments/1my9hxe/the_duality_of_man/,Battlefield6,1755974667.0,10,0.82,Image/Gif
1my9g79,https://www.reddit.com/r/Battlefield/comments/1my9g79/dice_heres_to_a_successful_bf6_launch/,,1,DICE - Here's to a Successful BF6 Launch!,KidElder,False,True,False,,False,"DICE, 

Just wanted to give you best wishes for a successful launch for BF6.  There is no doubt you are likely under a tremendous amount of pressure to make this launch successful.

Hopefully the two beta test sessions gave you enough information to know if the game's servers will hold up to what likely will be a huge weekend launch on Oct 10th.  Can't imagine how many folks will be taking off on Friday to play the game.

I'm rooting for a successful launch for you!  See ya on the Battlefield!",False,/r/Battlefield/comments/1my9g79/dice_heres_to_a_successful_bf6_launch/,Battlefield,1755974555.0,2,0.55,Battlefield 6
1my9da0,https://www.reddit.com/r/Borderlands4/comments/1my9da0/performance_on_lower_end_pcs/,,1,Performance On Lower End PCs,NoN-Stop-Dank,False,True,False,,False,"I saw on a Moxsy video when he first tried the game and he said the performance was on and off. Which he seemed disappointed about. I would imagine Moxsy would have a decent PC as well. So, I'm kinda asking if anyone knows the bench marks for the 20 series? I haven't found anything online about it expect the Switch performance and the 50 series DLSS performance. It's crazy to me that's becoming ""low end"" as well. 



I have a 2070 Super and I'm so nervous that the game won't run. Everything else in my PC is fine expect gpu. BF6 ran amazing, but DICE probably did witch craft to make it optimized so good. ",False,/r/Borderlands4/comments/1my9da0/performance_on_lower_end_pcs/,Borderlands4,1755974370.0,14,0.67,❔ [ Question ]
